Cites,Authors,Title,Year,Source,Publisher,ArticleURL,CitesURL,GSRank,QueryDate,Type,DOI,ISSN,CitationURL,Volume,Issue,StartPage,EndPage,ECC,CitesPerYear,CitesPerAuthor,AuthorCount,Age,Abstract,FullTextURL,RelatedURL
6,"BP Evans, K Glavatskiy, MS Harré…","The impact of social influence in Australian real estate: market forecasting with a spatial agent-based model",2021,"Journal of Economic …","Springer","https://idp.springer.com/authorize/casa?redirect_uri=https://link.springer.com/article/10.1007/s11403-021-00324-7&casa_token=_PQv0WbjhOwAAAAA:xK7cNdPhMCkRzGFj2i1jPNg1zDOfTMwtchbfl3PsdYJaT4EM4ySxlIw3CPCOgHDLokQKGBpma0ccf-bK8tk","https://scholar.google.com/scholar?cites=8152146429554474185&as_sdt=2005&sciodt=0,5&hl=en",106,"2021-09-23 12:35:59","HTML","10.1007/s11403-021-00324-7&casa_token=_PQv0WbjhOwAAAAA:xK7cNdPhMCkRzGFj2i1jPNg1zDOfTMwtchbfl3PsdYJaT4EM4ySxlIw3CPCOgHDLokQKGBpma0ccf-bK8tk","","",,,,,6,6.00,2,4,1,"Housing markets are inherently spatial, yet many existing models fail to capture this spatial dimension. Here, we introduce a new graph-based approach for incorporating a spatial component in a large-scale urban housing agent-based model (ABM). The model explicitly …","https://idp.springer.com/authorize/casa?redirect_uri=https://link.springer.com/article/10.1007/s11403-021-00324-7&casa_token=_PQv0WbjhOwAAAAA:xK7cNdPhMCkRzGFj2i1jPNg1zDOfTMwtchbfl3PsdYJaT4EM4ySxlIw3CPCOgHDLokQKGBpma0ccf-bK8tk","https://scholar.google.com/scholar?q=related:yTyQWvw9InEJ:scholar.google.com/&scioq=&hl=en&as_sdt=2005&sciodt=0,5"
5,"A Ghosh, R Radhakrishnan","Time-dependent antagonist-agonist switching in receptor tyrosine kinase-mediated signaling",2019,"BMC bioinformatics","Springer","https://link.springer.com/article/10.1186/s12859-019-2816-3","https://scholar.google.com/scholar?cites=14948540925574572446&as_sdt=2005&sciodt=0,5&hl=en",107,"2021-09-23 12:35:59","HTML","10.1186/s12859-019-2816-3","","",,,,,5,2.50,3,2,2,"ErbB4/HER4 is a unique member of the ErbB family of receptor tyrosine kinases concerning its activation of anti-proliferative JAK2-STAT5 pathway when stimulated by ligand Neuregulin (NRG). Activation of this pathway leads to expression of genes like β-casein …","https://link.springer.com/article/10.1186/s12859-019-2816-3","https://scholar.google.com/scholar?q=related:nulCY8Xic88J:scholar.google.com/&scioq=&hl=en&as_sdt=2005&sciodt=0,5"
4,"S Peters, PG Hains, N Lucas…","A Case Study and Methodology for OpenSWATH Parameter Optimization Using the ProCan90 Data Set and 45 810 Computational Analysis Runs",2019,"Journal of proteome …","ACS Publications","https://pubs.acs.org/doi/abs/10.1021/acs.jproteome.8b00709","https://scholar.google.com/scholar?cites=28445768188882625&as_sdt=2005&sciodt=0,5&hl=en",108,"2021-09-23 12:35:59","","10.1021/acs.jproteome.8b00709","","",,,,,4,2.00,1,4,2,"In the current study, we show how ProCan90, a curated data set of HEK293 technical replicates, can be used to optimize the configuration options for algorithms in the OpenSWATH pipeline. Furthermore, we use this case study as a proof of concept for …","","https://scholar.google.com/scholar?q=related:we5ChEYPZQAJ:scholar.google.com/&scioq=&hl=en&as_sdt=2005&sciodt=0,5"
8,"K Kundu, N Weber, C Griebler…","Phenotypic heterogeneity as key factor for growth and survival under oligotrophic conditions",2020,"Environmental …","Wiley Online Library","https://sfamjournals.onlinelibrary.wiley.com/doi/abs/10.1111/1462-2920.15106","https://scholar.google.com/scholar?cites=9424575511937495792&as_sdt=2005&sciodt=0,5&hl=en",109,"2021-09-23 12:35:59","","10.1111/1462-2920.15106","","",,,,,8,8.00,2,4,1,"Productivity‐poor oligotrophic environments are plentiful on earth. Yet it is not well understood how organisms maintain population sizes under these extreme conditions. Most scenarios consider the adaptation of a single microorganism (isogenic) at the cellular level …","https://sfamjournals.onlinelibrary.wiley.com/doi/pdf/10.1111/1462-2920.15106","https://scholar.google.com/scholar?q=related:8DLhm37RyoIJ:scholar.google.com/&scioq=&hl=en&as_sdt=2005&sciodt=0,5"
5,"MZ Bin Mohd Zawawi, T Kim…","Sustainable fabrication of glass nanostructures using infrared transparent mold assisted by CO2 laser scanning irradiation",2018,"Journal of …","asmedigitalcollection.asme.org","https://asmedigitalcollection.asme.org/manufacturingscience/article-abstract/doi/10.1115/1.4041181/366990","https://scholar.google.com/scholar?cites=11340678143544946090&as_sdt=2005&sciodt=0,5&hl=en",110,"2021-09-23 12:35:59","","10.1115/1.4041181","","",,,,,5,1.67,2,3,3,"Direct thermal imprinting of nanostructures on glass substrates is reliable when manufacturing net-shaped glass devices with various surface functions. However, several problems are recognized, including a long thermal cycle, tedious optimization, difficulties in …","https://www.researchgate.net/profile/Taekyung-Kim-3/publication/327097920_Sustainable_Fabrication_of_Glass_Nanostructures_Using_Infrared_Transparent_Mold_Assisted_by_CO2_Laser_Scanning_Irradiation/links/5bd00ed24585152b14511550/Sustainable-Fabrication-of-Glass-Nanostructures-Using-Infrared-Transparent-Mold-Assisted-by-CO2-Laser-Scanning-Irradiation.pdf","https://scholar.google.com/scholar?q=related:qm0Ioq8uYp0J:scholar.google.com/&scioq=&hl=en&as_sdt=2005&sciodt=0,5"
6,"H Ma, EP Li, AC Cangellaris, X Chen","Support vector regression-based active subspace (SVR-AS) modeling of high-speed links for fast and accurate sensitivity analysis",2020,"IEEE Access","ieeexplore.ieee.org","https://ieeexplore.ieee.org/abstract/document/9068208/","https://scholar.google.com/scholar?cites=9585451565917627460&as_sdt=2005&sciodt=0,5&hl=en",111,"2021-09-23 12:35:59","","","","",,,,,6,6.00,2,4,1,"A methodology based on the joint usage of support vector regression and active subspace is introduced in this paper for accelerated sensitivity analysis of high-speed links through parameter space dimensionality reduction. The proposed methodology uses the gradient …","https://ieeexplore.ieee.org/iel7/6287639/8948470/09068208.pdf","https://scholar.google.com/scholar?q=related:RGQ7zmldBoUJ:scholar.google.com/&scioq=&hl=en&as_sdt=2005&sciodt=0,5"
4,"JE Fajardo, F Vericat, G Irastorza…","Sensitivity analysis on imaging the calcaneus using microwaves",2019,"Biomedical Physics …","iopscience.iop.org","https://iopscience.iop.org/article/10.1088/2057-1976/ab3330/meta","https://scholar.google.com/scholar?cites=2237473867883865192&as_sdt=2005&sciodt=0,5&hl=en",112,"2021-09-23 12:35:59","","","","",,,,,4,2.00,1,4,2,"The bone quality is associated with changes in its dielectric properties (permittivity and conductivity). The feasibility of detecting changes in these properties was evaluated by using a tomographic array of 16 monopole antennas with z-polarized microwaves at 1.3 GHz. The …","https://arxiv.org/pdf/1709.04934","https://scholar.google.com/scholar?q=related:aORv0aAaDR8J:scholar.google.com/&scioq=&hl=en&as_sdt=2005&sciodt=0,5"
4,"J Parikh, P Di Achielle, J Kozloski, V Gurev","Intrinsic structure of model-derived metrics for in silico proarrhytmic risk assessment identified by global sensitivity analysis",2019,"bioRxiv","biorxiv.org","https://www.biorxiv.org/content/10.1101/543926v2.abstract","https://scholar.google.com/scholar?cites=4971201134267933853&as_sdt=2005&sciodt=0,5&hl=en",113,"2021-09-23 12:35:59","","10.1101/543926v2.abstract","","",,,,,4,2.00,1,4,2,"Multiscale computational models of heart are being extensively investigated for improved assessment of drug-induced Torsades de Pointes (TdP) risk, a fatal side effect of many drugs. Model-derived metrics (features) such as action potential duration and net charge …","https://www.biorxiv.org/content/biorxiv/early/2019/02/07/543926.full.pdf","https://scholar.google.com/scholar?q=related:nSQP0xdB_UQJ:scholar.google.com/&scioq=&hl=en&as_sdt=2005&sciodt=0,5"
4,"D Brizard, E Jacquelin","Uncertainty quantification and global sensitivity analysis of longitudinal wave propagation in circular bars. Application to SHPB device",2018,"International Journal of Solids and Structures","Elsevier","https://www.sciencedirect.com/science/article/pii/S0020768317305097","https://scholar.google.com/scholar?cites=6391729385508042289&as_sdt=2005&sciodt=0,5&hl=en",114,"2021-09-23 12:35:59","HTML","","","",,,,,4,1.33,2,2,3,"The experimental characterisation of materials at intermediate strain rates often implies the use of split Hopkinson pressure bars. Shifting the measured pulses in the bars requires to take dispersion into account. However, the dispersion correction, in the case of linear elastic …","https://www.sciencedirect.com/science/article/pii/S0020768317305097","https://scholar.google.com/scholar?q=related:Mfah4wL8s1gJ:scholar.google.com/&scioq=&hl=en&as_sdt=2005&sciodt=0,5"
4,"R Lafage, S Defoort, T Lefebvre","WhatsOpt: a web application for multidisciplinary design analysis and optimization",2019,"AIAA Aviation 2019 Forum","arc.aiaa.org","https://arc.aiaa.org/doi/pdf/10.2514/6.2019-2990","https://scholar.google.com/scholar?cites=9883814431720173578&as_sdt=2005&sciodt=0,5&hl=en",115,"2021-09-23 12:35:59","","10.2514/6.2019-2990","","",,,,,4,2.00,1,3,2,"This paper describes ONERA's on-going effort to develop a collaborative environment to support multidisciplinary design analysis and optimization in the context of overall vehicle design team activities. This environment, namely WhatsOpt, is a web application allowing …","https://www.researchgate.net/profile/Remi-Lafage/publication/333806928_WhatsOpt_a_web_application_for_multidisciplinary_design_analysis_and_optimization/links/5d2301bd92851cf4406f500a/WhatsOpt-a-web-application-for-multidisciplinary-design-analysis-and-optimization.pdf","https://scholar.google.com/scholar?q=related:CnCP5NtcKokJ:scholar.google.com/&scioq=&hl=en&as_sdt=2005&sciodt=0,5"
4,"MN Jones, H Forero-Hernandez, A Zubov, B Sarup…","Splitting Triglycerides with a Counter-Current Liquid–Liquid Spray Column: Modeling, Global Sensitivity Analysis, Parameter Estimation and Optimization",2019,"Processes","mdpi.com","https://www.mdpi.com/582186","https://scholar.google.com/scholar?cites=6480669998630115058&as_sdt=2005&sciodt=0,5&hl=en",116,"2021-09-23 12:35:59","","","","",,,,,4,2.00,1,5,2,"In this work we present the model of a counter-current spray column in which a triglyceride (tripalmitic triglyceride) is hydrolyzed by water and leads to fatty acid (palmitic acid) and glycerol. A finite volume model (FVM) of the column was developed to describe the reactive …","https://www.mdpi.com/2227-9717/7/12/881/htm","https://scholar.google.com/scholar?q=related:8hbhFgf371kJ:scholar.google.com/&scioq=&hl=en&as_sdt=2005&sciodt=0,5"
5,"P Parodi, D Le Quang, F Bariselli…","Study of a collector-intake system for VLEO air-breathing platforms",2019,"… Conference on Flight …","researchgate.net","https://www.researchgate.net/profile/Federico-Bariselli-2/publication/337060417_Study_of_a_collector-intake_system_for_VLEO_air-breathing_platforms/links/5dc2ee4f92851c8180331ea9/Study-of-a-collector-intake-system-for-VLEO-air-breathing-platforms.pdf","https://scholar.google.com/scholar?cites=17607951018702495776&as_sdt=2005&sciodt=0,5&hl=en",117,"2021-09-23 12:35:59","PDF","","","",,,,,5,2.50,1,4,2,"We present the advances on the development of a passive intakecollector system for Air-Breathing Electric Propulsion platforms orbiting Earth at altitudes below 250 km. First, we assess the conditions encountered by a spacecraft in a selection of candidate orbits, and we …","https://www.researchgate.net/profile/Federico-Bariselli-2/publication/337060417_Study_of_a_collector-intake_system_for_VLEO_air-breathing_platforms/links/5dc2ee4f92851c8180331ea9/Study-of-a-collector-intake-system-for-VLEO-air-breathing-platforms.pdf","https://scholar.google.com/scholar?q=related:IGA9HCkCXPQJ:scholar.google.com/&scioq=&hl=en&as_sdt=2005&sciodt=0,5"
4,"T Tröndle","Supply-side options to reduce land requirements of fully renewable electricity in Europe",2020,"PloS one","journals.plos.org","https://journals.plos.org/plosone/article?id=10.1371/journal.pone.0236958","https://scholar.google.com/scholar?cites=4996774002480139741&as_sdt=2005&sciodt=0,5&hl=en",118,"2021-09-23 12:35:59","HTML","","","",,,,,4,4.00,4,1,1,"Renewable electricity can fully decarbonise the European electricity supply, but large land requirements may cause land-use conflicts. Using a dynamic model that captures renewable fluctuations, I explore the relationship between land requirements and total system cost of …","https://journals.plos.org/plosone/article?id=10.1371/journal.pone.0236958","https://scholar.google.com/scholar?q=related:3U28MHsbWEUJ:scholar.google.com/&scioq=&hl=en&as_sdt=2005&sciodt=0,5"
4,"TB Wild, AN Birnbaum, PM Reed, DP Loucks","An open source reservoir and sediment simulation framework for identifying and evaluating siting, design, and operation alternatives",2021,"Environmental Modelling & …","Elsevier","https://www.sciencedirect.com/science/article/pii/S1364815220310045","https://scholar.google.com/scholar?cites=3225562161532525944&as_sdt=2005&sciodt=0,5&hl=en",119,"2021-09-23 12:35:59","HTML","","","",,,,,4,4.00,1,4,1,"This paper introduces PySedSim, an open-source, object-oriented, Python-based, daily time step river basin simulation screening model for flow, sediment, and hydropower in networks of reservoirs and river channels. The model enables users to explore representations of four …","https://www.sciencedirect.com/science/article/pii/S1364815220310045","https://scholar.google.com/scholar?q=related:eF0WN7J_wywJ:scholar.google.com/&scioq=&hl=en&as_sdt=2005&sciodt=0,5"
4,"EE Koks, T Haer","A high-resolution wind damage model for Europe",2020,"Scientific reports","nature.com","https://www.nature.com/articles/s41598-020-63580-w","https://scholar.google.com/scholar?cites=17764891486412675984&as_sdt=2005&sciodt=0,5&hl=en",120,"2021-09-23 12:35:59","HTML","","","",,,,,4,4.00,2,2,1,"Extreme wind events are among the costliest natural disasters in Europe, causing severe damages every year. Despite the significant impact, damages related to windstorms are an understudied topic in academia. For damage estimates, the community mostly relies on post …","https://www.nature.com/articles/s41598-020-63580-w","https://scholar.google.com/scholar?q=related:kBv9OK-SifYJ:scholar.google.com/&scioq=&hl=en&as_sdt=2005&sciodt=0,5"
3,"M Gasanov, A Petrovskaia, A Nikitin, S Matveev…","Sensitivity analysis of soil parameters in crop model supported with high-throughput computing",2020,"International Conference …","Springer","https://link.springer.com/chapter/10.1007/978-3-030-50436-6_54","https://scholar.google.com/scholar?cites=17069136699264532942&as_sdt=2005&sciodt=0,5&hl=en",121,"2021-09-23 12:35:59","HTML","10.1007/978-3-030-50436-6_54","","",,,,,3,3.00,1,5,1,"Uncertainty of input parameters in crop models and high costs of their experimental evaluation provide an exciting opportunity for sensitivity analysis, which allows identifying the most significant parameters for different crops. In this research, we perform a sensitivity …","https://link.springer.com/chapter/10.1007/978-3-030-50436-6_54","https://scholar.google.com/scholar?q=related:zgE_TmTB4ewJ:scholar.google.com/&scioq=&hl=en&as_sdt=2005&sciodt=0,5"
5,"W Finnigan, J Citoler, SC Cosgrove…","Rapid Model-Based Optimization of a Two-Enzyme System for Continuous Reductive Amination in Flow",2020,"… Process Research & …","ACS Publications","https://pubs.acs.org/doi/abs/10.1021/acs.oprd.0c00075","https://scholar.google.com/scholar?cites=5914336230977819992&as_sdt=2005&sciodt=0,5&hl=en",122,"2021-09-23 12:35:59","","10.1021/acs.oprd.0c00075","","",,,,,5,5.00,1,4,1,"Enzymes are increasingly combined into multienzyme systems for cost and productivity benefits. Further advantages can be gained through the use of immobilized enzymes, allowing continuous biotransformations in flow. However, the optimization of such …","","https://scholar.google.com/scholar?q=related:WNWncXfxE1IJ:scholar.google.com/&scioq=&hl=en&as_sdt=2005&sciodt=0,5"
4,"NM Naughton, JG Georgiadis","Global sensitivity analysis of skeletal muscle dMRI metrics: Effects of microstructural and pulse parameters",2020,"Magnetic resonance in …","Wiley Online Library","https://onlinelibrary.wiley.com/doi/abs/10.1002/mrm.28014","https://scholar.google.com/scholar?cites=12776737043420854503&as_sdt=2005&sciodt=0,5&hl=en",123,"2021-09-23 12:35:59","","10.1002/mrm.28014","","",,,,,4,4.00,2,2,1,"Purpose Estimating microstructural parameters of skeletal muscle from diffusion MRI (dMRI) signal requires understanding the relative importance of both microstructural and dMRI sequence parameters on the signal. This study seeks to determine the sensitivity of dMRI …","https://par.nsf.gov/servlets/purl/10208445","https://scholar.google.com/scholar?q=related:57isnaUWULEJ:scholar.google.com/&scioq=&hl=en&as_sdt=2005&sciodt=0,5"
3,"A Serafino, B Obert, P Cinnella","Multi-fidelity gradient-based strategy for robust optimization in computational fluid dynamics",2020,"Algorithms","mdpi.com","https://www.mdpi.com/843822","https://scholar.google.com/scholar?cites=5532655815452282932&as_sdt=2005&sciodt=0,5&hl=en",124,"2021-09-23 12:35:59","","","","",,,,,3,3.00,1,3,1,"Abstract Efficient Robust Design Optimization (RDO) strategies coupling a parsimonious uncertainty quantification (UQ) method with a surrogate-based multi-objective genetic algorithm (SMOGA) are investigated for a test problem in computational fluid dynamics …","https://www.mdpi.com/1999-4893/13/10/248/pdf","https://scholar.google.com/scholar?q=related:NFCIoCbxx0wJ:scholar.google.com/&scioq=&hl=en&as_sdt=2005&sciodt=0,5"
3,"Y Zhao, Z Guo, F Niu, Y Yu, S Wang","Global sensitivity analysis of passive safety systems of FHR by using meta-modeling and sampling methods",2019,"Progress in Nuclear Energy","Elsevier","https://www.sciencedirect.com/science/article/pii/S0149197019300599?casa_token=5Qdn5rRbnacAAAAA:06JadMAqtqAFnu5CoHEkg5Uq_hU7D3nfktfgP44lzRxMQhj5MGhPw1_t8RvnPqR9Mw_9mREsmahk","https://scholar.google.com/scholar?cites=16775193352356715845&as_sdt=2005&sciodt=0,5&hl=en",125,"2021-09-23 12:35:59","HTML","","","",,,,,3,1.50,1,5,2,"Global sensitivity analysis (GSA) aims at quantifying the individual effect of input variables and the main idea is to decompose the variance of a physical model response into fractions that can be attributed to inputs. The Sobol'indices are obtained by adopting different …","https://www.sciencedirect.com/science/article/pii/S0149197019300599?casa_token=5Qdn5rRbnacAAAAA:06JadMAqtqAFnu5CoHEkg5Uq_hU7D3nfktfgP44lzRxMQhj5MGhPw1_t8RvnPqR9Mw_9mREsmahk","https://scholar.google.com/scholar?q=related:RV23pXl1zegJ:scholar.google.com/&scioq=&hl=en&as_sdt=2005&sciodt=0,5"
6,"O Roberts, P Bunting, A Hardy, D McInerney","Sensitivity Analysis of the DART Model for Forest Mensuration with Airborne Laser Scanning",2020,"Remote Sensing","mdpi.com","https://www.mdpi.com/614572","https://scholar.google.com/scholar?cites=4867826690941291147&as_sdt=2005&sciodt=0,5&hl=en",126,"2021-09-23 12:35:59","","","","",,,,,6,6.00,2,4,1,"Abstract Airborne Laser Scanning (ALS) measurements are increasingly vital in forest management and national forest inventories. Despite the growing reliance on ALS data, comparatively little research has examined the sensitivity of ALS measurements to varying …","https://www.mdpi.com/2072-4292/12/2/247/pdf","https://scholar.google.com/scholar?q=related:i4q4pZX-jUMJ:scholar.google.com/&scioq=&hl=en&as_sdt=2005&sciodt=0,5"
6,"VV Grigoriev, O Iliev, PN Vabishchevich","Computational identification of adsorption and desorption parameters for pore scale transport in periodic porous media",2020,"Journal of Computational and …","Elsevier","https://www.sciencedirect.com/science/article/pii/S0377042719306661","https://scholar.google.com/scholar?cites=3317627454609145595&as_sdt=2005&sciodt=0,5&hl=en",127,"2021-09-23 12:35:59","HTML","","","",,,,,6,6.00,2,3,1,"Computational identification of unknown adsorption and desorption rates is discussed in conjunction with reactive flow considered at pore scale. The reactive transport is governed by incompressible Stokes equations, coupled with convection–diffusion equation for species …","https://www.sciencedirect.com/science/article/pii/S0377042719306661","https://scholar.google.com/scholar?q=related:-74PqZeUCi4J:scholar.google.com/&scioq=&hl=en&as_sdt=2005&sciodt=0,5"
5,"MM Singh, S Singaravel…","Improving Prediction Accuracy of Machine Learning Energy Prediction Models",2019,"Proceedings of the …","architektur-informatik.scix.net","https://architektur-informatik.scix.net/pdfs/w78-2019-paper-011.pdf","https://scholar.google.com/scholar?cites=8549545388250914480&as_sdt=2005&sciodt=0,5&hl=en",128,"2021-09-23 12:35:59","PDF","","","",,,,,5,2.50,2,3,2,"Abstract Machine learning (ML) energy prediction models are useful to estimate the building energy demand with short response time, particularly important for developing energy-efficient building designs at an early stage of design. Component-based machine learning …","https://architektur-informatik.scix.net/pdfs/w78-2019-paper-011.pdf","https://scholar.google.com/scholar?q=related:sF7GsTsWpnYJ:scholar.google.com/&scioq=&hl=en&as_sdt=2005&sciodt=0,5"
3,"AA Chaudhry, J Buchwald, T Nagel","Local and global spatio-temporal sensitivity analysis of thermal consolidation around a point heat source",2021,"International Journal of Rock …","Elsevier","https://www.sciencedirect.com/science/article/pii/S1365160921000484?casa_token=58mFD5cWbQsAAAAA:hIGZAfRiqcymFdWJhZ7SZefKp085SvCTakud_Irii6ZpQ3VJMrf0K_0UhXDra9-wXkoG1OAnB5jw","https://scholar.google.com/scholar?cites=15657193295039607355&as_sdt=2005&sciodt=0,5&hl=en",129,"2021-09-23 12:35:59","HTML","","","",,,,,3,3.00,1,3,1,"Coupled thermo–hydro-mechanical (THM) models are used for the assessment of nuclear waste disposal, reservoir engineering, and many other branches of geotechnical engineering. Model-based decision making and optimization often entail sensitivity analyses …","https://www.sciencedirect.com/science/article/pii/S1365160921000484?casa_token=58mFD5cWbQsAAAAA:hIGZAfRiqcymFdWJhZ7SZefKp085SvCTakud_Irii6ZpQ3VJMrf0K_0UhXDra9-wXkoG1OAnB5jw","https://scholar.google.com/scholar?q=related:O7J2sliGSdkJ:scholar.google.com/&scioq=&hl=en&as_sdt=2005&sciodt=0,5"
8,"A Lashkaripour, C Rodriguez, N Mehdipour…","Machine learning enables design automation of microfluidic flow-focusing droplet generation",2021,"Nature …","nature.com","https://www.nature.com/articles/s41467-020-20284-z","https://scholar.google.com/scholar?cites=46891953916805841&as_sdt=2005&sciodt=0,5&hl=en",130,"2021-09-23 12:35:59","HTML","","","",,,,,8,8.00,2,4,1,"Droplet-based microfluidic devices hold immense potential in becoming inexpensive alternatives to existing screening platforms across life science applications, such as enzyme discovery and early cancer detection. However, the lack of a predictive understanding of …","https://www.nature.com/articles/s41467-020-20284-z","https://scholar.google.com/scholar?q=related:0QIJ0PuXpgAJ:scholar.google.com/&scioq=&hl=en&as_sdt=2005&sciodt=0,5"
3,"A Hadjimichael, J Quinn, P Reed","Advancing diagnostic model evaluation to better understand water shortage mechanisms in institutionally complex river basins",2020,"Water Resources Research","Wiley Online Library","https://agupubs.onlinelibrary.wiley.com/doi/abs/10.1029/2020WR028079","https://scholar.google.com/scholar?cites=13897019847509113697&as_sdt=2005&sciodt=0,5&hl=en",131,"2021-09-23 12:35:59","","10.1029/2020WR028079","","",,,,,3,3.00,1,3,1,"Water resources systems models enable valuable inferences on consequential system stressors by representing both the geophysical processes determining the movement of water and the human elements distributing it to its various competing uses. This study …","https://drive.google.com/file/d/17HePOUauABTxAZ2rSNZB7VRm3eCG6vcN/view","https://scholar.google.com/scholar?q=related:YXtV9-sh3MAJ:scholar.google.com/&scioq=&hl=en&as_sdt=2005&sciodt=0,5"
5,"TB Barnhart, CL Tague…","The counteracting effects of snowmelt rate and timing on runoff",2020,"Water Resources …","Wiley Online Library","https://agupubs.onlinelibrary.wiley.com/doi/abs/10.1029/2019WR026634","https://scholar.google.com/scholar?cites=18061524531239748353&as_sdt=2005&sciodt=0,5&hl=en",132,"2021-09-23 12:35:59","","10.1029/2019WR026634","","",,,,,5,5.00,2,3,1,"The declining mountain snowpack is expected to melt earlier and more slowly with climate warming. Previous work indicates that lower snowmelt rates are associated with decreased runoff. However, earlier snowmelt could increase runoff via lower vegetation water use in …","","https://scholar.google.com/scholar?q=related:AYOM-t1sp_oJ:scholar.google.com/&scioq=&hl=en&as_sdt=2005&sciodt=0,5"
5,"S Delbecq","Knowledge-based multidisciplinary sizing and optimization of embedded mechatronic systems-application to aerospace electro-mechanical actuation systems",2018,"","theses.fr","https://www.theses.fr/2018ISAT0034","https://scholar.google.com/scholar?cites=16085005122776075748&as_sdt=2005&sciodt=0,5&hl=en",133,"2021-09-23 12:35:59","","","","",,,,,5,1.67,5,1,3,"Résumé Un défi à court terme pour les industriels de l'aéronautique est de concevoir des produits sûrs, fiables, compactes, basse consommation et à faible impact environnemental due à la forte concurrence et à l'augmentation des attentes des clients et des autorités de …","https://www.theses.fr/2018ISAT0034.pdf","https://scholar.google.com/scholar?q=related:5A1o6e9qOd8J:scholar.google.com/&scioq=&hl=en&as_sdt=2005&sciodt=0,5"
