Cites,Authors,Title,Year,Source,Publisher,ArticleURL,CitesURL,GSRank,QueryDate,Type,DOI,ISSN,CitationURL,Volume,Issue,StartPage,EndPage,ECC,CitesPerYear,CitesPerAuthor,AuthorCount,Age,Abstract,FullTextURL,RelatedURL
0,"D Shaweno, KC Horton, RJ Hayes, PJ Dodd","Assortative social mixing and sex disparities in tuberculosis burden",2021,"Scientific reports","nature.com","https://www.nature.com/articles/s41598-021-86869-w","",275,"2021-09-23 12:35:59","HTML","","","",,,,,0,0.00,0,4,1,"Globally, men have higher tuberculosis (TB) burden but the mechanisms underlying this sex disparity are not fully understood. Recent surveys of social mixing patterns have established moderate preferential within-sex mixing in many settings. This assortative mixing could …","https://www.nature.com/articles/s41598-021-86869-w","https://scholar.google.com/scholar?q=related:HpAKR0ArfbEJ:scholar.google.com/&scioq=&hl=en&as_sdt=2005&sciodt=0,5"
0,"S Emmert","Developing and calibrating a numerical model for microbially enhanced coal-bed methane production",2021,"","elib.uni-stuttgart.de","http://elib.uni-stuttgart.de/handle/11682/11648","",276,"2021-09-23 12:35:59","","","","",,,,,0,0.00,0,1,1,"Experimental investigations demonstrate the potential of microbially enhanced coal-bed methane (MECBM) production on the lab scale. However, no in-depth mathematical and conceptual model including all sub-processes is reported in literature so far. With this study …","http://elib.uni-stuttgart.de/bitstream/11682/11648/1/emmert_dissertation_2021_opus.pdf",""
0,"R Ballester-Ripoll, EG Paredes, R Pajarola","Tensor Approximation of Advanced Metrics for Sensitivity Analysis",2017,"arXiv preprint arXiv …","arxiv.org","https://arxiv.org/abs/1712.01633","",277,"2021-09-23 12:35:59","","","","",,,,,0,0.00,0,3,4,"Following up on the success of the analysis of variance (ANOVA) decomposition and the Sobol indices (SI) for global sensitivity analysis, various related quantities of interest have been defined in the literature including the effective and mean dimensions, the dimension …","https://arxiv.org/pdf/1712.01633","https://scholar.google.com/scholar?q=related:rpMpSIxDF7QJ:scholar.google.com/&scioq=&hl=en&as_sdt=2005&sciodt=0,5"
0,"M Jaxa-Rozen, AS Pratiwi, E Trutnevyte","Variance-based global sensitivity analysis and beyond in life cycle assessment: an application to geothermal heating networks",2021,"The International Journal of Life …","Springer","https://link.springer.com/article/10.1007/s11367-021-01921-1","",278,"2021-09-23 12:35:59","HTML","10.1007/s11367-021-01921-1","","",,,,,0,0.00,0,3,1,"Purpose Global sensitivity analysis increasingly replaces manual sensitivity analysis in life cycle assessment (LCA). Variance-based global sensitivity analysis identifies influential uncertain model input parameters by estimating so-called Sobol indices that represent each …","https://link.springer.com/article/10.1007/s11367-021-01921-1","https://scholar.google.com/scholar?q=related:mYX2SODnG7cJ:scholar.google.com/&scioq=&hl=en&as_sdt=2005&sciodt=0,5"
0,"M Molamohammadi","Generative Modeling and Sensitivity Analysis of Gallium Arsenide-Based Solar Cell Device Processes",2021,"","search.proquest.com","https://search.proquest.com/openview/90c5e567f0aa29bca03225889805ac52/1?pq-origsite=gscholar&cbl=18750&diss=y&casa_token=vTDlNXWm6FYAAAAA:B6lGa_jTV_L8NrgxzwYmipIWlGAjW6VfiFUpLq__dbGNarW6k_kM1u2F3hiwCt7hguai-3g0abg","",279,"2021-09-23 12:35:59","HTML","","","",,,,,0,0.00,0,1,1,"Modeling and process optimization of solar cell devices is a complex procedure due to the high-dimensional parameter space. Moreover, the need for enhancing renewable energy market share is an undeniable fact. Machine learning is rapidly emerging in many fields …","https://search.proquest.com/openview/90c5e567f0aa29bca03225889805ac52/1?pq-origsite=gscholar&cbl=18750&diss=y&casa_token=vTDlNXWm6FYAAAAA:B6lGa_jTV_L8NrgxzwYmipIWlGAjW6VfiFUpLq__dbGNarW6k_kM1u2F3hiwCt7hguai-3g0abg",""
0,"L Ekblad, JD Herman","Toward data‐driven generation and evaluation of model structure for integrated representations of human behavior in water resources systems",2021,"Water Resources Research","Wiley Online Library","https://agupubs.onlinelibrary.wiley.com/doi/abs/10.1029/2020WR028148","",280,"2021-09-23 12:35:59","","10.1029/2020WR028148","","",,,,,0,0.00,0,2,1,"Simulations of human behavior in water resources systems are challenged by uncertainty in model structure and parameters. The increasing availability of observations describing these systems provides the opportunity to infer a set of plausible model structures using data …","","https://scholar.google.com/scholar?q=related:c8VCUJ0_y2kJ:scholar.google.com/&scioq=&hl=en&as_sdt=2005&sciodt=0,5"
1,"X Peng, J Adamowski, A Inam, MR Alizadeh…","Development of a behaviour-pattern based global sensitivity analysis procedure for coupled socioeconomic and environmental models",2020,"Journal of …","Elsevier","https://www.sciencedirect.com/science/article/pii/S0022169420302055?casa_token=13LxXnuxIpMAAAAA:CsAq9ZVoQuZdYiCGKPSeNu--BjAzY3uTDGOZqKYwa_RFW2-c9e-Dg8gDF1UOzysYEcrJ7nynmZaS","https://scholar.google.com/scholar?cites=12530195177630853286&as_sdt=2005&sciodt=0,5&hl=en",281,"2021-09-23 12:35:59","HTML","","","",,,,,1,1.00,0,5,1,"Abstract Dynamically Coupled Socioeconomic system dynamics models integrated with physically-based Environmental Models (DCSEM) can capture relationships between complex environmental and socioeconomic systems, and are promising tools for …","https://www.sciencedirect.com/science/article/pii/S0022169420302055?casa_token=13LxXnuxIpMAAAAA:CsAq9ZVoQuZdYiCGKPSeNu--BjAzY3uTDGOZqKYwa_RFW2-c9e-Dg8gDF1UOzysYEcrJ7nynmZaS","https://scholar.google.com/scholar?q=related:puj_UCAy5K0J:scholar.google.com/&scioq=&hl=en&as_sdt=2005&sciodt=0,5"
0,"MM Singh, S Singaravel, P Geyer","Machine learning for early stage building energy prediction: Increment and enrichment",2021,"Applied Energy","Elsevier","https://www.sciencedirect.com/science/article/pii/S0306261921011247?casa_token=eMHsY8ew8F0AAAAA:RYyrmA86NfUqwirJy-kn_O5W2FoFUfSBUSYb-c5270jF2qDKNt98T6ehenpkVNlNF3xnpVix9bIJ","",282,"2021-09-23 12:35:59","HTML","","","",,,,,0,0.00,0,3,1,"Collecting data for machine learning (ML) development is a resource-intensive task that necessitates identifying an efficient data collection approach. This study focuses on ML models that provide quick energy results by dramatically reducing computational demand …","https://www.sciencedirect.com/science/article/pii/S0306261921011247?casa_token=eMHsY8ew8F0AAAAA:RYyrmA86NfUqwirJy-kn_O5W2FoFUfSBUSYb-c5270jF2qDKNt98T6ehenpkVNlNF3xnpVix9bIJ",""
0,"X Xu","NEXT GENERATION ELECTRIC VEHICLE ENERGY MODELING IN TRANSPORTATION NETWORKS",2019,"","smartech.gatech.edu","https://smartech.gatech.edu/handle/1853/64002","",283,"2021-09-23 12:35:59","","","","",,,,,0,0.00,0,1,2,"Electric vehicles (EVs) will play a central role in future energy-efficient and sustainable transportation systems. Predicting the energy use for EVs is a complex issue because the onboard vehicle systems are trying to balance the provision of power to the wheels as well …","https://smartech.gatech.edu/bitstream/handle/1853/64002/XU-DISSERTATION-2019.pdf","https://scholar.google.com/scholar?q=related:IHloU_xJM7gJ:scholar.google.com/&scioq=&hl=en&as_sdt=2005&sciodt=0,5"
0,"C Ren, Y Aoues, D Lemosse, ES De Cursi","Global Sensitivity Analysis of Offshore Wind Turbine Jacket",2020,"International Symposium on …","Springer","https://link.springer.com/chapter/10.1007/978-3-030-53669-5_3","",284,"2021-09-23 12:35:59","","10.1007/978-3-030-53669-5_3","","",,,,,0,0.00,0,4,1,"Nowadays, offshore wind turbine (OWT) energy is considered as one of the most promising among renewable energies. Many researches have been done to study offshore wind turbine foundations like jacket and monopile. The sensitivity analysis of the foundation can …","","https://scholar.google.com/scholar?q=related:4lswVGwasQYJ:scholar.google.com/&scioq=&hl=en&as_sdt=2005&sciodt=0,5"
0,"O Kusyy","Simulation-based optimization of solar thermal systems",2018,"","kobra.uni-kassel.de","https://kobra.uni-kassel.de/handle/123456789/11009","",285,"2021-09-23 12:35:59","","","","",,,,,0,0.00,0,1,3,"In this PhD thesis application of numerical methods to simulation-based optimization of solar thermal systems both in the planning process and in operation is investigated. The optimization process starting from definition of a target function and specification of …","https://kobra.uni-kassel.de/bitstream/handle/123456789/11009/DissertationOlehKusyy.pdf?sequence=1","https://scholar.google.com/scholar?q=related:PnBdVYGwWoIJ:scholar.google.com/&scioq=&hl=en&as_sdt=2005&sciodt=0,5"
0,"NHF Beebe","A Complete Bibliography of Publications in the Journal of Open Source Software",2018,"","netlib.org","http://www.netlib.org/tex/bib/joss.pdf","",286,"2021-09-23 12:35:59","PDF","","","",,,,,0,0.00,0,1,3,"Nelson HF Beebe University of Utah Department of Mathematics, 110 LCB 155 S 1400 E RM 233 Salt Lake City, UT 84112-0090 USA … E-mail: beebe@math.utah.edu, beebe@acm.org, beebe@computer.org (Internet) WWW URL: http://www.math.utah.edu/~beebe …","http://www.netlib.org/tex/bib/joss.pdf","https://scholar.google.com/scholar?q=related:e9WWVsxKnUMJ:scholar.google.com/&scioq=&hl=en&as_sdt=2005&sciodt=0,5"
2,"CK Shuler, KE Mariner","Collaborative groundwater modeling: Open-source, cloud-based, applied science at a small-island water utility scale",2020,"Environmental Modelling & Software","Elsevier","https://www.sciencedirect.com/science/article/pii/S136481521930934X","https://scholar.google.com/scholar?cites=3437623281825471527&as_sdt=2005&sciodt=0,5&hl=en",287,"2021-09-23 12:35:59","HTML","","","",,,,,2,2.00,1,2,1,"Recent advances in cloud-computing and social-networking are influencing how we communicate professionally, work collaboratively, and approach data-science tasks. Here we show how the groundwater modeling field is well positioned to benefit from these …","https://www.sciencedirect.com/science/article/pii/S136481521930934X","https://scholar.google.com/scholar?q=related:J9zRWCnktC8J:scholar.google.com/&scioq=&hl=en&as_sdt=2005&sciodt=0,5"
0,"VQ Mai","Mathematical models for the kinetics of some carbohydrate enzymes",2019,"","aran.library.nuigalway.ie","https://aran.library.nuigalway.ie/bitstream/handle/10379/15725/2019VinhPhD.pdf?sequence=1","",288,"2021-09-23 12:35:59","PDF","","","",,,,,0,0.00,0,1,2,"School of Mathematics, Statistics and Applied Mathematics … Supervisors: Dr. Tuoi Vo and Dr. Martin Meere … 3 Modelling hyaluronan degradation by Streptococcus pneumoniae hyaluronate lyase … 3.1.2 The function of hyaluronan depends on its molecular weight …","https://aran.library.nuigalway.ie/bitstream/handle/10379/15725/2019VinhPhD.pdf?sequence=1","https://scholar.google.com/scholar?q=related:NtWwWknz1Z0J:scholar.google.com/&scioq=&hl=en&as_sdt=2005&sciodt=0,5"
0,"M Rajesh, S Rehana","Prediction of river water temperature using machine learning algorithms: a tropical river system of India",2021,"Journal of Hydroinformatics","iwaponline.com","https://iwaponline.com/jh/article-abstract/23/3/605/81372","",289,"2021-09-23 12:35:59","","","","",,,,,0,0.00,0,2,1,"Abstract Machine learning (ML) has been increasingly adopted due to its ability to model complex and non-linearities between river water temperature (RWT) and its predictors (eg, Air Temperature, AT). Most of these ML approaches have been applied using average AT …","https://iwaponline.com/jh/article-pdf/23/3/605/892611/jh0230605.pdf","https://scholar.google.com/scholar?q=related:LZ_kW_pmDkAJ:scholar.google.com/&scioq=&hl=en&as_sdt=2005&sciodt=0,5"
0,"K Li, Y Long, H Wang, YF Wang","Modeling and Sensitivity Analysis of Concrete Creep with Machine Learning Methods",2021,"Journal of Materials in Civil …","ascelibrary.org","https://ascelibrary.org/doi/abs/10.1061/%28ASCE%29MT.1943-5533.0003843","",290,"2021-09-23 12:35:59","","10.1061/%28ASCE%29MT.1943-5533.0003843","","",,,,,0,0.00,0,4,1,"Although machine learning algorithms to predict the mechanical properties of concrete have been studied extensively, most of the research focused on the prediction of the strength of concrete and only a few studies have focused on concrete creep. This paper analyzed the …","","https://scholar.google.com/scholar?q=related:vsmLXe7x9WoJ:scholar.google.com/&scioq=&hl=en&as_sdt=2005&sciodt=0,5"
0,"C Sampat, R Ramachandran","Identification of Granule Growth Regimes in High Shear Wet Granulation Processes Using a Physics-Constrained Neural Network",2021,"Processes","mdpi.com","https://www.mdpi.com/1082008","",291,"2021-09-23 12:35:59","","","","",,,,,0,0.00,0,2,1,"The digitization of manufacturing processes has led to an increase in the availability of process data, which has enabled the use of data-driven models to predict the outcomes of these manufacturing processes. Data-driven models are instantaneous in simulate and can …","https://www.mdpi.com/2227-9717/9/5/737/pdf","https://scholar.google.com/scholar?q=related:tUcEXovLpxoJ:scholar.google.com/&scioq=&hl=en&as_sdt=2005&sciodt=0,5"
1,"B Kurent, B Brank, WK Ao","Model updating of seven-storey cross-laminated timber building designed on frequency-response-functions-based modal testing",2021,"Structure and Infrastructure …","Taylor & Francis","https://www.tandfonline.com/doi/abs/10.1080/15732479.2021.1931893","https://scholar.google.com/scholar?cites=7170267681156835023&as_sdt=2005&sciodt=0,5&hl=en",292,"2021-09-23 12:35:59","","10.1080/15732479.2021.1931893","","",,,,,1,1.00,0,3,1,"Based on the experimental estimation of the key dynamic properties of a seven-storey building made entirely of cross-laminated timber (CLT) panels, the finite element (FE) model updating was performed. The dynamic properties were obtained from an input-output full …","https://www.tandfonline.com/doi/pdf/10.1080/15732479.2021.1931893","https://scholar.google.com/scholar?q=related:zybRX3fogWMJ:scholar.google.com/&scioq=&hl=en&as_sdt=2005&sciodt=0,5"
0,"Z Yuan, K Yu, JE Mottershead","Parameter selection for model updating based on the global sensitivity method",2018,"Journal of Physics: Conference …","iopscience.iop.org","https://iopscience.iop.org/article/10.1088/1742-6596/1106/1/012004/meta","",293,"2021-09-23 12:35:59","","","","",,,,,0,0.00,0,3,3,"A new model-updating parameter selection method based on global sensitivity analysis is presented in this work. A specifically designed evaluation function is used for the probability that the sample fits the distribution of test data. In contrast to other parameter selection …","https://iopscience.iop.org/article/10.1088/1742-6596/1106/1/012004/pdf","https://scholar.google.com/scholar?q=related:1qMwYCOHjTEJ:scholar.google.com/&scioq=&hl=en&as_sdt=2005&sciodt=0,5"
0,"A Murali","Data-Driven Robotic Grasping in the Wild",2020,"","search.proquest.com","https://search.proquest.com/openview/a5e42d3aa865cde75fdbe8c5207c5efb/1?pq-origsite=gscholar&cbl=18750&diss=y&casa_token=fx63ZPSRhwAAAAAA:i0TZH4gn0D8d_Cn9cBpk2PYTBUoeJl1LH2PBF4OifPuK52COMoer8ZN8azOco0tnMGtcgvy7fO8","",294,"2021-09-23 12:35:59","HTML","","","",,,,,0,0.00,0,1,1,"Robotic grasping has seen tremendous advancements in recent years. Yet, the current paradigm of manipulation research is typically some form of table-top manipulation in constrained setups or in simulation. Building general purpose personal robots that can …","https://search.proquest.com/openview/a5e42d3aa865cde75fdbe8c5207c5efb/1?pq-origsite=gscholar&cbl=18750&diss=y&casa_token=fx63ZPSRhwAAAAAA:i0TZH4gn0D8d_Cn9cBpk2PYTBUoeJl1LH2PBF4OifPuK52COMoer8ZN8azOco0tnMGtcgvy7fO8","https://scholar.google.com/scholar?q=related:c55jYM_LzH4J:scholar.google.com/&scioq=&hl=en&as_sdt=2005&sciodt=0,5"
1,"C Ashraf, J Pfaendtner","Assessing the Performance of Various Stochastic Optimization Methods on Chemical Kinetic Modeling of Combustion",2020,"Industrial & Engineering Chemistry …","ACS Publications","https://pubs.acs.org/doi/abs/10.1021/acs.iecr.0c04009","https://scholar.google.com/scholar?cites=17542513980461736144&as_sdt=2005&sciodt=0,5&hl=en",295,"2021-09-23 12:35:59","","10.1021/acs.iecr.0c04009","","",,,,,1,1.00,1,2,1,"The solution to chemical kinetic models for a particular reactor configuration is usually composed of a set of stiff ordinary differential equations (ODEs), where a number of rate parameters have to be estimated to fit with experimental observations. This presents a …","","https://scholar.google.com/scholar?q=related:0OC-YIWHc_MJ:scholar.google.com/&scioq=&hl=en&as_sdt=2005&sciodt=0,5"
0,"A Serbouti, M Rattal, EM Oualim…","Innovative time efficient method to optimize buildings' performance using Design of Experiment, Polynomial Regression and Genetic Algorithms",2021,"Journal of Physics …","iopscience.iop.org","https://iopscience.iop.org/article/10.1088/1742-6596/1714/1/012014/meta","",296,"2021-09-23 12:35:59","","","","",,,,,0,0.00,0,4,1,"Dynamic thermal simulation use is essential for studying complex building systems. One of the major challenges to widely deploy optimization in this field'engineering and research is the high computational cost to perform the required simulation-based iterations. To …","https://iopscience.iop.org/article/10.1088/1742-6596/1714/1/012014/pdf","https://scholar.google.com/scholar?q=related:_DOtYY9_q1kJ:scholar.google.com/&scioq=&hl=en&as_sdt=2005&sciodt=0,5"
0,"J Student, MR Kramer, P Steinmann","Coasting: Model description, global sensitivity analysis, and scenario discovery",2020,"MethodsX","Elsevier","https://www.sciencedirect.com/science/article/pii/S2215016120303654","",297,"2021-09-23 12:35:59","HTML","","","",,,,,0,0.00,0,3,1,"This manuscript provides information for replicating the Coasting agent-based model presented in “Simulating emerging coastal tourism vulnerabilities: an agent-based modelling approach”. The model description follows the Overview, Design Concepts, and …","https://www.sciencedirect.com/science/article/pii/S2215016120303654","https://scholar.google.com/scholar?q=related:Z0yeZqcvyyAJ:scholar.google.com/&scioq=&hl=en&as_sdt=2005&sciodt=0,5"
0,"JD Smith, L Lin, JD Quinn…","Guidance on evaluating parametric model uncertainty at decision-relevant scales",2021,"Hydrology and Earth …","hess.copernicus.org","https://hess.copernicus.org/preprints/hess-2021-324/","",298,"2021-09-23 12:35:59","","","","",,,,,0,0.00,0,4,1,"Spatially distributed hydrologic models are commonly employed to optimize the locations of engineering control measures across a watershed. Yet, parameter screening exercises that aim to reduce the dimensionality of the calibration search space are typically completed only …","https://hess.copernicus.org/preprints/hess-2021-324/hess-2021-324.pdf","https://scholar.google.com/scholar?q=related:15PDZtr2WCoJ:scholar.google.com/&scioq=&hl=en&as_sdt=2005&sciodt=0,5"
0,"O Marko","Application of Innovative Methods of Machine Learning in Biosystems",2019,"","search.proquest.com","https://search.proquest.com/openview/79bd3c7785e595d9a2a6801ebe957844/1?pq-origsite=gscholar&cbl=18750&diss=y&casa_token=U8suLqMYYWQAAAAA:p1jDyBrrNECq-ZCvNfFi9Mbi5TyA_QcwYiSL1O-TIxdQLV-0i64Y-_OZQNi41SK9CUStuwcQKSk","",299,"2021-09-23 12:35:59","HTML","","","",,,,,0,0.00,0,1,2,"The topic of the research in this dissertation is the application of machine learning in solving problems characteristic to biosystems, with special emphasis on agriculture. Firstly, an innovative regression algorithm based on big data was presented, that was used for yield …","https://search.proquest.com/openview/79bd3c7785e595d9a2a6801ebe957844/1?pq-origsite=gscholar&cbl=18750&diss=y&casa_token=U8suLqMYYWQAAAAA:p1jDyBrrNECq-ZCvNfFi9Mbi5TyA_QcwYiSL1O-TIxdQLV-0i64Y-_OZQNi41SK9CUStuwcQKSk","https://scholar.google.com/scholar?q=related:LQ1laPlOKZMJ:scholar.google.com/&scioq=&hl=en&as_sdt=2005&sciodt=0,5"
0,"P Oleśkiewicz, CM Baugh","Sensitivity analysis of a galaxy formation model",2020,"Monthly Notices of the Royal …","academic.oup.com","https://academic.oup.com/mnras/article-abstract/493/2/1827/5682498","",300,"2021-09-23 12:35:59","","","","",,,,,0,0.00,0,2,1,"We present the first application of a variance-based sensitivity analysis (SA) to a model that aims to predict the evolution and properties of the whole galaxy population. SA is a well-established technique in other quantitative sciences, but is a relatively novel tool for the …","https://arxiv.org/pdf/1910.01745","https://scholar.google.com/scholar?q=related:L2Rob8o-zBcJ:scholar.google.com/&scioq=&hl=en&as_sdt=2005&sciodt=0,5"
1,"R Jayapalan-Nair, E Brembilla, C Hopfe, J Mardaljevic","Influence of building design on occupant comfort in adaptive climate zones",,"repository.lboro.ac.uk","","https://repository.lboro.ac.uk/articles/conference%20contribution/Influence_of_building_design_on_occupant_comfort_in_adaptive_climate_zones/12017076","https://scholar.google.com/scholar?cites=5409129733421188871&as_sdt=2005&sciodt=0,5&hl=en",301,"2021-09-23 12:35:59","","","","",,,,,1,0.00,0,4,,"The responsiveness of buildings to prevailing local climate plays an important role if the dual aspects of occupant comfort and low energy demand are to be met. This study takes as example the State of Kerala in India where the Government–as part of the project titled …","https://repository.lboro.ac.uk/articles/conference_contribution/Influence_of_building_design_on_occupant_comfort_in_adaptive_climate_zones/12017076/files/22079697.pdf","https://scholar.google.com/scholar?q=related:B8eScNUWEUsJ:scholar.google.com/&scioq=&hl=en&as_sdt=2005&sciodt=0,5"
0,"M Van Hove, P Fennell, L Weinberg…","Challenges and Lessons Learned in Applying Sensitivity Analysis to Building Stock Energy Models",2021,"17th IBPSA …","biblio.ugent.be","https://biblio.ugent.be/publication/8719219","",302,"2021-09-23 12:35:59","","","","",,,,,0,0.00,0,4,1,"Uncertainty Analysis (UA) and Sensitivity Analysis (SA) offer essential tools to determine the limits of inference of a model and explore the factors which have the most effect on the model outputs. However, despite a wellestablished body of work applying UA and SA to …","https://biblio.ugent.be/publication/8719219/file/8719221",""
0,"L Conibear, CL Reddington, BJ Silver, Y Chen…","Statistical emulation of winter ambient fine particulate matter concentrations from emission changes in China",2021,"…","Wiley Online Library","https://agupubs.onlinelibrary.wiley.com/doi/abs/10.1029/2021GH000391","",303,"2021-09-23 12:35:59","","10.1029/2021GH000391","","",,,,,0,0.00,0,5,1,"Air pollution exposure remains a leading public health problem in China. The use of chemical transport models to quantify the impacts of various emission changes on air quality is limited by their large computational demands. Machine learning models can emulate …","https://agupubs.onlinelibrary.wiley.com/doi/pdfdirect/10.1029/2021GH000391","https://scholar.google.com/scholar?q=related:D5MqcT6dO_MJ:scholar.google.com/&scioq=&hl=en&as_sdt=2005&sciodt=0,5"
0,"M Jeannerot, M Ouisse, V Lanfranchi…","Two‐level global sensitivity analysis of the excitation contributions leading to acoustic noise in an electric motor for the purpose of robust optimisation",2021,"IET Electric Power …","Wiley Online Library","https://ietresearch.onlinelibrary.wiley.com/doi/abs/10.1049/elp2.12129","",304,"2021-09-23 12:35:59","","10.1049/elp2.12129","","",,,,,0,0.00,0,4,1,"This study presents a sensitivity analysis methodology used for electric motor design. This innovative approach evaluates both global effects of parameter variations in their design range and of parameter deviations in their tolerance intervals on design objectives. For the …","",""
0,"M Rabe, AA Juan, N Mustafee, A Skoogh, S Jain…","JUST-IN-TIME PARALLEL SIMULATION",,"publish.illinois.edu","","http://publish.illinois.edu/science-of-security-lablet/files/2019/01/Just-In-Time-Parallel-Siumlation.pdf","",305,"2021-09-23 12:35:59","PDF","","","",,,,,0,0.00,0,6,,"Due to the evolution of programming languages, interpreted languages have gained widespread use in scientific and research computing. Interpreted languages excel at being portable, easy to use, and fast in prototyping than their ahead-of-time (AOT) counterparts …","http://publish.illinois.edu/science-of-security-lablet/files/2019/01/Just-In-Time-Parallel-Siumlation.pdf","https://scholar.google.com/scholar?q=related:Hv97cgTgf8kJ:scholar.google.com/&scioq=&hl=en&as_sdt=2005&sciodt=0,5"
0,"J Foramitti, I Savin, JCJM van den Bergh","Regulation at the source? Comparing upstream and downstream climate policies",2021,"Technological Forecasting and …","Elsevier","https://www.sciencedirect.com/science/article/pii/S0040162521004923","",306,"2021-09-23 12:35:59","HTML","","","",,,,,0,0.00,0,3,1,"Climate policies can be applied either upstream, where fossil fuels are extracted, or downstream, where emissions are generated. Specific policy instruments can be defined for either level, and can take the form of a price signal such as through a tax, or a quantity limit …","https://www.sciencedirect.com/science/article/pii/S0040162521004923",""
0,"DR Lastiri","Modelling and identification of water and nutrient balances in aquaponics",2021,"","library.wur.nl","https://library.wur.nl/WebQuery/wurpubs/fulltext/548235","",307,"2021-09-23 12:35:59","PDF","","","",,,,,0,0.00,0,1,1,"Page 1. M o d ellin g an d id en tificatio n o f w ater an d n u trien t b alan ces in aq u ap o n ics D anielR eyes Lastiri 2021 Modelling and identification of water and nutrient balances in aquaponics Daniel Reyes Lastiri Page 2. Propositions 1. Real-time measurements of soluble …","https://library.wur.nl/WebQuery/wurpubs/fulltext/548235",""
