Cites,Authors,Title,Year,Source,Publisher,ArticleURL,CitesURL,GSRank,QueryDate,Type,DOI,ISSN,CitationURL,Volume,Issue,StartPage,EndPage,ECC,CitesPerYear,CitesPerAuthor,AuthorCount,Age,Abstract,FullTextURL,RelatedURL
1,"V Gabriele-Rivet, MP Ward, J Arsenault…","Could a rabies incursion spread in the northern Australian dingo population? Development of a spatial stochastic simulation model",2021,"PLoS neglected …","journals.plos.org","https://journals.plos.org/plosntds/article?id=10.1371/journal.pntd.0009124","https://scholar.google.com/scholar?cites=9739907940451657885&as_sdt=2005&sciodt=0,5&hl=en",174,"2021-06-03 16:24:07","HTML","","","",,,,,1,1.00,0,4,1,"Australia, home to the iconic dingo, is currently free from canine rabies. However northern Australia, including Indigenous communities with large free-roaming domestic dog populations, is at increased risk of rabies incursion from nearby Indonesia. We developed a …","https://journals.plos.org/plosntds/article?id=10.1371/journal.pntd.0009124",""
1,"Y Ma, Z Yu, Y Wang, D Xie, E Jiaqiang","Investigation on the influence of initial thermodynamic conditions and fuel compositions on gasoline octane number based on a data-driven approach",2021,"Fuel","Elsevier","https://www.sciencedirect.com/science/article/pii/S0016236120331215","https://scholar.google.com/scholar?cites=13142510134969772610&as_sdt=2005&sciodt=0,5&hl=en",175,"2021-06-03 16:24:07","HTML","","","",,,,,1,1.00,0,5,1,"The objective of this work is to clarify the influence mechanism of initial thermodynamic conditions and fuel chemistry on gasoline's octane numbers (ON), including research octane number (RON) and motor octane number (MON). Investigated fuels include three kinds of …","https://www.sciencedirect.com/science/article/pii/S0016236120331215",""
1,"A Hadjimichael, J Quinn, P Reed","Advancing diagnostic model evaluation to better understand water shortage mechanisms in institutionally complex river basins",2020,"Water Resources Research","Wiley Online Library","https://agupubs.onlinelibrary.wiley.com/doi/abs/10.1029/2020WR028079","https://scholar.google.com/scholar?cites=13897019847509113697&as_sdt=2005&sciodt=0,5&hl=en",176,"2021-06-03 16:24:07","","10.1029/2020WR028079","","",,,,,1,1.00,0,3,1,"Water resources systems models enable valuable inferences on consequential system stressors by representing both the geophysical processes determining the movement of water and the human elements distributing it to its various competing uses. This study …","https://agupubs.onlinelibrary.wiley.com/doi/pdf/10.1029/2020WR028079","https://scholar.google.com/scholar?q=related:YXtV9-sh3MAJ:scholar.google.com/&scioq=&hl=en&as_sdt=2005&sciodt=0,5"
3,"TB Barnhart, CL Tague…","The counteracting effects of snowmelt rate and timing on runoff",2020,"Water Resources …","Wiley Online Library","https://agupubs.onlinelibrary.wiley.com/doi/abs/10.1029/2019WR026634","https://scholar.google.com/scholar?cites=18061524531239748353&as_sdt=2005&sciodt=0,5&hl=en",177,"2021-06-03 16:24:07","","10.1029/2019WR026634","","",,,,,3,3.00,1,3,1,"The declining mountain snowpack is expected to melt earlier and more slowly with climate warming. Previous work indicates that lower snowmelt rates are associated with decreased runoff. However, earlier snowmelt could increase runoff via lower vegetation water use in …","https://agupubs.onlinelibrary.wiley.com/doi/pdf/10.1029/2019WR026634","https://scholar.google.com/scholar?q=related:AYOM-t1sp_oJ:scholar.google.com/&scioq=&hl=en&as_sdt=2005&sciodt=0,5"
1,"E Ficiarà, F D'Agata, S Ansari, S Boschi…","A mathematical model for the evaluation of iron transport across the blood-cerebrospinal fluid barrier in neurodegenerative diseases",2020,"2020 42nd Annual …","ieeexplore.ieee.org","https://ieeexplore.ieee.org/abstract/document/9175988/","https://scholar.google.com/scholar?cites=10141399890205185415&as_sdt=2005&sciodt=0,5&hl=en",178,"2021-06-03 16:24:07","","","","",,,,,1,1.00,0,5,1,"Iron plays important roles in healthy brain but altered homeostasis and concentration have been correlated to aging and neurodegenerative diseases. Iron enters the central nervous system by crossing the brain barrier systems: the Blood-Brain Barrier separating blood and …","https://ieeexplore.ieee.org/iel7/9167168/9175149/09175988.pdf","https://scholar.google.com/scholar?q=related:h5Xd_Hd9vYwJ:scholar.google.com/&scioq=&hl=en&as_sdt=2005&sciodt=0,5"
1,"K Rachid","Estimation de la pression aortique à l'aide de l'imagerie par résonance magnétique: développement d'un modèle biomécanique d'écoulement",2018,"","theses.fr","https://www.theses.fr/2018SACLS251","https://scholar.google.com/scholar?cites=7627248709137711648&as_sdt=2005&sciodt=0,5&hl=en",179,"2021-06-03 16:24:07","","","","",,,,,1,0.33,1,1,3,"Résumé Les maladies cardiovasculaires représentent la première cause de mortalité dans le monde. L'hypertension artérielle et l'hypertrophie du ventricule gauche en constituent deux facteurs de risque souvent asymptomatiques. Dans ce contexte, la pression aortique s' …","https://www.theses.fr/2018SACLS251.pdf","https://scholar.google.com/scholar?q=related:IMK1QUpu2WkJ:scholar.google.com/&scioq=&hl=en&as_sdt=2005&sciodt=0,5"
1,"T Zipperle","Modellierung von Transformationspfaden für einen optimierten Energieeinsatz im Sektor Gewerbe, Handel, Dienstleistungen",2020,"","mediatum.ub.tum.de","https://mediatum.ub.tum.de/1521969","https://scholar.google.com/scholar?cites=11460744423095470771&as_sdt=2005&sciodt=0,5&hl=en",180,"2021-06-03 16:24:07","","","","",,,,,1,1.00,1,1,1,"In dieser Arbeit werden mögliche Transformationspfade des deutschen Sektors Gewerbe, Handel, Dienstleistungen hin zu einer klimafreundlichen Energieversorgung bis 2050 untersucht. Die Modellierung des heterogenen Sektors erfolgt, für sieben …","https://mediatum.ub.tum.de/doc/1521969/file.pdf","https://scholar.google.com/scholar?q=related:swolyFS-DJ8J:scholar.google.com/&scioq=&hl=en&as_sdt=2005&sciodt=0,5"
0,"JR Wang, P Steinmann","Exploring a Simulation Model of Canadian Energy Policy",2021,"","emi-ime.ca","https://emi-ime.ca/wp-content/uploads/2021/03/EMI-2020-Wang_report_Exploring-a-Simulation-Model_Steinmann.pdf","",181,"2021-06-03 16:24:07","PDF","","","",,,,,0,0.00,0,2,1,"We systematically explore the behavior of an integrated energy‑climate‑economy simu‑lation model to determine the importance of factors behind reducing greenhouse gas emis‑sions, and policy alternatives for reaching specific climate goals. We study the model's …","https://emi-ime.ca/wp-content/uploads/2021/03/EMI-2020-Wang_report_Exploring-a-Simulation-Model_Steinmann.pdf",""
0,"N Naughton, J Georgiadis","Connecting Diffusion MRI to Skeletal Muscle Microstructure: Leveraging Meta-Models and GPU-acceleration",2019,"Proceedings of the Practice and Experience …","dl.acm.org","https://dl.acm.org/doi/abs/10.1145/3332186.3333054","",182,"2021-06-03 16:24:07","","10.1145/3332186.3333054","","",,,,,0,0.00,0,2,2,"Due to its non-invasive nature, diffusion-weighted MRI (dMRI) has shown promise as a method to quantify skeletal muscle's microstructure; however, connecting the dMRI signal of muscle to the underlying microstructure is difficult. Numerical models of dMRI can …","https://dl.acm.org/doi/pdf/10.1145/3332186.3333054","https://scholar.google.com/scholar?q=related:lk4PA17MhI0J:scholar.google.com/&scioq=&hl=en&as_sdt=2005&sciodt=0,5"
1,"M Spirzewski, H Anglart, PM Stano","Uncertainty and sensitivity analysis of a phenomenological dryout model implemented in DARIA system code",2019,"Nuclear Engineering and Design","Elsevier","https://www.sciencedirect.com/science/article/pii/S0029549319302985","https://scholar.google.com/scholar?cites=5755888537619058748&as_sdt=2005&sciodt=0,5&hl=en",183,"2021-06-03 16:24:07","HTML","","","",,,,,1,0.50,0,3,2,"Uncertainties of numerical predictions play important role in assessment of safety margins in nuclear reactors. In this paper uncertainties of the predictions of the Hewitt-Govan model, which is used to determine the entrainment and deposition rates in phenomenological …","https://www.sciencedirect.com/science/article/pii/S0029549319302985","https://scholar.google.com/scholar?q=related:PNCGAyEG4U8J:scholar.google.com/&scioq=&hl=en&as_sdt=2005&sciodt=0,5"
1,"M Nguyen Quang, T Rogers, J Hofman…","Global Sensitivity Analysis of Metabolic Models for Phosphorus Accumulating Organisms in Enhanced Biological Phosphorus Removal",2019,"… in bioengineering and …","frontiersin.org","https://www.frontiersin.org/articles/10.3389/fbioe.2019.00234/full","https://scholar.google.com/scholar?cites=4743376081001420084&as_sdt=2005&sciodt=0,5&hl=en",184,"2021-06-03 16:24:07","HTML","","","",,,,,1,0.50,0,4,2,"The aim of this study was to identify, quantify and prioritise for the first time the sources of uncertainty in a mechanistic model describing the anaerobic-aerobic metabolism of phosphorus accumulating organisms (PAO) in enhanced biological phosphorus removal …","https://www.frontiersin.org/articles/10.3389/fbioe.2019.00234/full","https://scholar.google.com/scholar?q=related:NJUsCGrb00EJ:scholar.google.com/&scioq=&hl=en&as_sdt=2005&sciodt=0,5"
0,"M Grignard, C Geuzaine, C Phillips","shamo: A tool for electromagnetic modelling, simulation and sensitivity analysis of the head",2021,"arXiv preprint arXiv:2103.08164","arxiv.org","https://arxiv.org/abs/2103.08164","",185,"2021-06-03 16:24:07","","","","",,,,,0,0.00,0,3,1,"Accurate electromagnetic modelling of the head of a subject is of main interest in the fields of source reconstruction and brain stimulation. Those processes rely heavily on the quality of the model and, even though the geometry of the tissues can be extracted from magnetic …","https://arxiv.org/pdf/2103.08164",""
0,"Z Pang, Z O'Neill","A comparison study of various sensitivity analysis methods in building applications",,"ibpsa.org","","http://www.ibpsa.org/proceedings/BS2019/BS2019_210209.pdf","",186,"2021-06-03 16:24:07","PDF","","","",,,,,0,0.00,0,2,,"This paper aims to present a comparison study on the performances of different SA methods in building energy simulation. Firstly, a literature review on the principles and applications of several popular SA methods was conducted. Secondly, an EnergyPlus based Monte Carlo …","http://www.ibpsa.org/proceedings/BS2019/BS2019_210209.pdf","https://scholar.google.com/scholar?q=related:Quk_CgI-um8J:scholar.google.com/&scioq=&hl=en&as_sdt=2005&sciodt=0,5"
0,"NHF Beebe","A Bibliography of Publications about the Python Scripting and Programming Language",2021,"","ctan.math.utah.edu","https://scholar.google.comftp://ctan.math.utah.edu/pub/tex/bib/python.pdf","",187,"2021-06-03 16:24:07","PDF","","","",,,,,0,0.00,0,1,1,"Nelson HF Beebe University of Utah Department of Mathematics, 110 LCB 155 S 1400 E RM 233 Salt Lake City, UT 84112-0090 USA … E-mail: beebe@math.utah.edu, beebe@acm.org, beebe@computer.org (Internet) WWW URL: http://www.math.utah.edu/~beebe …","https://scholar.google.comftp://ctan.math.utah.edu/pub/tex/bib/python.pdf","https://scholar.google.com/scholar?q=related:rTnWDPYznbgJ:scholar.google.com/&scioq=&hl=en&as_sdt=2005&sciodt=0,5"
0,"MN Jones","Design and Optimisation of Oleochemical Processes",2019,"","core.ac.uk","https://core.ac.uk/download/pdf/219744014.pdf","",188,"2021-06-03 16:24:07","PDF","","","",,,,,0,0.00,0,1,2,"Abstract Process Systems Engineering (PSE) is a discipline which connects a wide range of chemical engineering topics in a systems view approach. The reason for this systematic view of this scientific field is the need of computational concepts, numerical methods and …","https://core.ac.uk/download/pdf/219744014.pdf","https://scholar.google.com/scholar?q=related:zuFYD6PjYocJ:scholar.google.com/&scioq=&hl=en&as_sdt=2005&sciodt=0,5"
0,"Y Hirono, T Sano, S Eguchi","Changes in the nitrogen footprint of green tea consumption in Japan from 1965 to 2016",2021,"Environmental Science and Pollution …","Springer","https://link.springer.com/article/10.1007/s11356-021-13767-z","",189,"2021-06-03 16:24:07","HTML","10.1007/s11356-021-13767-z","","",,,,,0,0.00,0,3,1,"Heavy application of nitrogen (N) in tea (Camellia sinensis (L.)) plantations causes various environmental problems. To date, studies on N flows have been limited to the tea plantation level, but the crucial drivers of N flows are consumers, not farmers. Therefore, this study …","https://link.springer.com/article/10.1007/s11356-021-13767-z",""
0,"GA Hoang","Stability Analysis of Colloids in Hydraulic Fracturing Fluids",2017,"","search.proquest.com","https://search.proquest.com/openview/c93b2dfdf64d1f317c9db2360e2a68e8/1?pq-origsite=gscholar&cbl=18750&diss=y","",190,"2021-06-03 16:24:07","BOOK","","","",,,,,0,0.00,0,1,4,"Hydraulic fracturing has become increasingly pervasive in regions where oil-and gas-yielding formations are present. Though researchers have been investigating the environmental impact of hydraulic fracturing processes for years, few studies have focused …","https://search.proquest.com/openview/c93b2dfdf64d1f317c9db2360e2a68e8/1?pq-origsite=gscholar&cbl=18750&diss=y","https://scholar.google.com/scholar?q=related:lwWKFTSxeV4J:scholar.google.com/&scioq=&hl=en&as_sdt=2005&sciodt=0,5"
0,"ABSSOF BINGE, DAS YOUNGSTERS, AM AYUSO","GRADO EN INGENIERÍA DE TECNOLOGÍAS Y SERVICIOS DE TELECOMUNICACION",2019,"","academia.edu","https://www.academia.edu/download/61683308/tfg-mujica20200105-44072-i2qgly.pdf","",191,"2021-06-03 16:24:07","PDF","","","",,,,,0,0.00,0,3,2,"Uno de los entretenimientos favoritos de los jóvenes es pasar tiempo en bares, discotecas o socializar en lugares públicos con otros jóvenes. En esta actividad el alcohol juega un papel importante, lo que causa agresiones y otros danos más graves, especialmente en …","https://www.academia.edu/download/61683308/tfg-mujica20200105-44072-i2qgly.pdf","https://scholar.google.com/scholar?q=related:c8pfFjFzcrMJ:scholar.google.com/&scioq=&hl=en&as_sdt=2005&sciodt=0,5"
0,"CS Brooks, T Kozlowski, ZJ Ooi, K Borowiec, C Wang…","Validation of RELAP-7 for Forced Convective and Natural Circulation Reactor Flows",2019,"","osti.gov","https://www.osti.gov/biblio/1592405","",192,"2021-06-03 16:24:07","","","","",,,,,0,0.00,0,6,2,"New reactor designs such as small modular reactors and newly proposed passive safety systems rely on natural circulation two-phase flow cooling of the reactor core under accident conditions. Without a pump to drive the flow, the circulation rate is a strong function of void …","https://www.osti.gov/servlets/purl/1592405","https://scholar.google.com/scholar?q=related:A7OyFw8uTQ0J:scholar.google.com/&scioq=&hl=en&as_sdt=2005&sciodt=0,5"
0,"C Stowers, T Lee, I Bilionis, AK Gosain…","Improving reconstructive surgery design using Gaussian process surrogates to capture material behavior uncertainty",2021,"Journal of the Mechanical …","Elsevier","https://www.sciencedirect.com/science/article/pii/S1751616121000321","",193,"2021-06-03 16:24:07","HTML","","","",,,,,0,0.00,0,5,1,"To produce functional, aesthetically natural results, reconstructive surgeries must be planned to minimize stress as excessive loads near wounds have been shown to produce pathological scarring and other complications (Gurtner et al., 2011). Presently, stress cannot …","https://www.sciencedirect.com/science/article/pii/S1751616121000321",""
1,"N Powers, DM Frangopol, R Al-Mahaidi, C Caprani","Maintenance, Safety, Risk, Management and Life-Cycle Performance of Bridges: Proceedings of the Ninth International Conference on Bridge Maintenance …",2018,"","books.google.com","https://books.google.com/books?hl=en&lr=&id=HFt0DwAAQBAJ&oi=fnd&pg=PP1&ots=-GpXNfmGc2&sig=UcJgbZMLsxpM20bzEk3UBupCZxY","https://scholar.google.com/scholar?cites=9158905858079570872&as_sdt=2005&sciodt=0,5&hl=en",194,"2021-06-03 16:24:07","BOOK","","","",,,,,1,0.33,0,4,3,"Maintenance, Safety, Risk, Management and Life-Cycle Performance of Bridges contains lectures and papers presented at the Ninth International Conference on Bridge Maintenance, Safety and Management (IABMAS 2018), held in Melbourne, Australia, 9-13 …","","https://scholar.google.com/scholar?q=related:uLsTGlr4Gn8J:scholar.google.com/&scioq=&hl=en&as_sdt=2005&sciodt=0,5"
0,"M Yang","Urban Flood Simulation and Integrated Flood Risk Management",2017,"","eldorado.tu-dortmund.de","https://eldorado.tu-dortmund.de/bitstream/2003/36992/1/Dissertation_Mu%20Yang.pdf","",195,"2021-06-03 16:24:07","PDF","","","",,,,,0,0.00,0,1,4,"Climate change induces the probability of occurring natural disasters; eg floods, Sea Level Rise, Green House Gases. Flood is considered one of the most dangerous phenomena that tremendously and dramatically threatening the human being and environment worldwide …","https://eldorado.tu-dortmund.de/bitstream/2003/36992/1/Dissertation_Mu%20Yang.pdf","https://scholar.google.com/scholar?q=related:6-PXGna3BUkJ:scholar.google.com/&scioq=&hl=en&as_sdt=2005&sciodt=0,5"
0,"SY Najafabadi","Computational Modelling of Emissions from Gas Turbines: Ensuring Experimental Reliability and Quantifying Emissions Uncertainty",2019,"","aran.library.nuigalway.ie","https://aran.library.nuigalway.ie/bitstream/handle/10379/14963/2019_SajjadYousefianNajafabadi.pdf?sequence=1","",196,"2021-06-03 16:24:07","PDF","","","",,,,,0,0.00,0,1,2,"Global environmental concerns and the increasing amount of power generated using gas turbines have led to the development of dry low emission (DLE) combustion systems to minimize the NOx and CO pollutants. Improvements in current emissions modelling …","https://aran.library.nuigalway.ie/bitstream/handle/10379/14963/2019_SajjadYousefianNajafabadi.pdf?sequence=1","https://scholar.google.com/scholar?q=related:blcHHGIPLkYJ:scholar.google.com/&scioq=&hl=en&as_sdt=2005&sciodt=0,5"
0,"T Méndez, JF Sánchez-Rada, CA Iglesias…","A Model of Radicalization Growth using Agent-based Social Simulation",,"ecsorl.com","","https://www.ecsorl.com/wp-content/uploads/2018/06/emas_2018-enviado.pdf","",197,"2021-06-03 16:24:07","PDF","","","",,,,,0,0.00,0,4,,"This work presents an agent based model of radicalization growth based on social theories. The model aims at improving the understanding of the influence of social links on radicalism spread. The model consists of two main entities, a Spread Model and an Agent Model. The …","https://www.ecsorl.com/wp-content/uploads/2018/06/emas_2018-enviado.pdf","https://scholar.google.com/scholar?q=related:rIm7HkdgOacJ:scholar.google.com/&scioq=&hl=en&as_sdt=2005&sciodt=0,5"
0,"P Zikalala, I Kisekka, M Grismer","Calibration and Global Sensitivity Analysis for a Salinity Model Used in Evaluating Fields Irrigated with Treated Wastewater in the Salinas Valley",2019,"Agriculture","mdpi.com","https://www.mdpi.com/2077-0472/9/2/31","",198,"2021-06-03 16:24:07","","","","",,,,,0,0.00,0,3,2,"Treated wastewater irrigation began two decades ago in the Salinas Valley of California and provides a unique opportunity to evaluate the long-term effects of this strategy on soil salinization. We used data from a long-term field experiment that included application of a …","https://www.mdpi.com/2077-0472/9/2/31/pdf","https://scholar.google.com/scholar?q=related:BZy8IQUn7I0J:scholar.google.com/&scioq=&hl=en&as_sdt=2005&sciodt=0,5"
0,"D Degen, K Veroy…","Crustal-Scale Thermal Models: Revisiting the Influence of Deep Boundary Conditions",2021,"Earth and Space …","search.proquest.com","https://search.proquest.com/openview/e2f1a67c4b4cc1e1f7162f321b72e937/1?pq-origsite=gscholar&cbl=4882998","",199,"2021-06-03 16:24:07","HTML","","","",,,,,0,0.00,0,3,1,"The societal importance of geothermal energy is significantly increasing because of its low carbon-dioxide footprint. However, geothermal exploration is also subject to high risks. For a better assessment of these risks, extensiveparameter studies are required that improve our …","https://search.proquest.com/openview/e2f1a67c4b4cc1e1f7162f321b72e937/1?pq-origsite=gscholar&cbl=4882998",""
0,"VV Grigoriev, O Iliev, PN Vabishchevich","Modified Bee Colony optimization algorithm for computational parameter identification for pore scale transport in periodic porous media",2020,"arXiv preprint arXiv:2003.02653","arxiv.org","https://arxiv.org/abs/2003.02653","",200,"2021-06-03 16:24:07","","","","",,,,,0,0.00,0,3,1,"This paper discusses an optimization method called Modified Bee Colony algorithm (MBC) based on a particular intelligent behavior of honeybee swarms. The algorithm was checked in a few benchmarks like Shekel, Rozenbroke, Himmelblau and Rastrigin functions, then …","https://arxiv.org/pdf/2003.02653","https://scholar.google.com/scholar?q=related:sO5EJRPaZtIJ:scholar.google.com/&scioq=&hl=en&as_sdt=2005&sciodt=0,5"
0,"C Blakely, H Zhang, C Folsom, H Ban…","Application of regression, variance, and density based global sensitivity methods to integrated VERA-CS and BISON simulations",2018,"Nuclear Engineering and …","Elsevier","https://www.sciencedirect.com/science/article/pii/S0029549318302942","",201,"2021-06-03 16:24:07","HTML","","","",,,,,0,0.00,0,5,3,"Uncertainty quantification (UQ) and sensitivity analyses (SA) are performed for coupled simulations between VERA-CS, a coupled pin resolved neutron transport and subchannel thermal hydraulics code, and the fuel performance code BISON. The interface between …","https://www.sciencedirect.com/science/article/pii/S0029549318302942","https://scholar.google.com/scholar?q=related:kBNGJUKJcEUJ:scholar.google.com/&scioq=&hl=en&as_sdt=2005&sciodt=0,5"
0,"M Zollmann, B Rubinsky, A Liberzon, A Golberg","Multi-Scale Modeling of Intensive Macroalgae Cultivation and Marine Nitrogen Sequestration",2020,"bioRxiv","biorxiv.org","https://www.biorxiv.org/content/10.1101/2020.10.25.338798v1.abstract","",202,"2021-06-03 16:24:07","","10.1101/2020.10.25.338798v1.abstract","","",,,,,0,0.00,0,4,1,"Multi-scale macroalgae growth models are required for the efficient design of sustainable, economically viable and environmentally safe farms. Here, we develop a multi-scale model for Ulva sp. macroalgae growth and nitrogen sequestration in an intensive cultivation farm …","https://www.biorxiv.org/content/biorxiv/early/2020/10/25/2020.10.25.338798.full.pdf","https://scholar.google.com/scholar?q=related:Ss-4JVG38B4J:scholar.google.com/&scioq=&hl=en&as_sdt=2005&sciodt=0,5"
0,"DA Maldonado, M Anitescu","Variance-Based Sensitivity Analysis of the Composite Dynamic Load Model",2020,"2020 IEEE Power & Energy …","ieeexplore.ieee.org","https://ieeexplore.ieee.org/abstract/document/9281523/","",203,"2021-06-03 16:24:07","","","","",,,,,0,0.00,0,2,1,"As dynamic load models become more granular, the number of parameters increases and sensitivity analysis studies become necessary to rank the importance each parameter has on the transient quality. One important objective of these studies is to determine how model …","https://scholar.google.com/scholar?output=instlink&q=info:gIv5JQHltSYJ:scholar.google.com/&hl=en&as_sdt=2005&sciodt=0,5&scillfp=17535557965666458736&oi=lle","https://scholar.google.com/scholar?q=related:gIv5JQHltSYJ:scholar.google.com/&scioq=&hl=en&as_sdt=2005&sciodt=0,5"
0,"J Rogelj, K Zickfeld","Current fossil fuel infrastructure does not yet commit us to 1.5 C warming",,"eplanning.blm.gov","","https://eplanning.blm.gov/public_projects/nepa/109410/20017611/250023595/Smith_2019_Current_FF.pdf","",204,"2021-06-03 16:24:07","PDF","","","",,,,,0,0.00,0,2,,"Results Scenarios and model. We define infrastructural commitments based on assumptions around today's carbon-emitting capital stock. In our central scenario, CO2 emissions are phased out from the end of 2018 at a close to linear rate, becoming near zero after 40 years …","https://eplanning.blm.gov/public_projects/nepa/109410/20017611/250023595/Smith_2019_Current_FF.pdf","https://scholar.google.com/scholar?q=related:N4-0J4NnPvMJ:scholar.google.com/&scioq=&hl=en&as_sdt=2005&sciodt=0,5"
0,"M Spirzewski, P Domitr, P Darnowski","Global uncertainty and sensitivity analysis of MELCOR and TRACE critical flow models against MARVIKEN tests",2021,"Nuclear Engineering and Design","Elsevier","https://www.sciencedirect.com/science/article/pii/S0029549321001023","",205,"2021-06-03 16:24:07","HTML","","","",,,,,0,0.00,0,3,1,"Uncertainties of numerical predictions play important role in assessment of safety margins in nuclear reactors. Critical Flow models are used in the different types of Nuclear Safety Analysis but these are especially important in Loss of Coolant Accidents (LOCA) analyses …","https://www.sciencedirect.com/science/article/pii/S0029549321001023",""
0,"M Rausch, WH Sanders","Stacked Metamodels for Sensitivity Analysis and Uncertainty Quantification of AMI Models",2020,"2020 IEEE International Conference …","ieeexplore.ieee.org","https://ieeexplore.ieee.org/abstract/document/9302957/","",206,"2021-06-03 16:24:07","","","","",,,,,0,0.00,0,2,1,"Models can help architects design effective and secure advanced metering infrastructure (AMI) deployments. Because of the complex interactions among the numerous smart meters, smart home devices, customers, the utility, and potential adversaries, the models are often …","https://www.perform.illinois.edu/Papers/USAN_papers/20RAU02.pdf","https://scholar.google.com/scholar?q=related:M1DaKfUvM6cJ:scholar.google.com/&scioq=&hl=en&as_sdt=2005&sciodt=0,5"
