Cites,Authors,Title,Year,Source,Publisher,ArticleURL,CitesURL,GSRank,QueryDate,Type,DOI,ISSN,CitationURL,Volume,Issue,StartPage,EndPage,ECC,CitesPerYear,CitesPerAuthor,AuthorCount,Age,Abstract,FullTextURL,RelatedURL
1,"FJ Bellido-Leiva, RA Lusardi, JR Lund","Modeling the effect of habitat availability and quality on endangered winter-run Chinook salmon (Oncorhynchus tshawytscha) production in the Sacramento …",2021,"Ecological Modelling","Elsevier","https://www.sciencedirect.com/science/article/pii/S030438002100082X?casa_token=cMuZufmBF7kAAAAA:waP44aFiivhHrSpukl2qA0QbehY7S6F4vc16QA_hccfHqH1yQzhBF5LIet8c1s4_LvMSz53jnxst","https://scholar.google.com/scholar?cites=16201572809703896343&as_sdt=2005&sciodt=0,5&hl=en",186,"2021-09-23 12:35:59","HTML","","","",,,,,1,1.00,0,3,1,"Reconciliation between water uses and sustaining aquatic species populations requires an effort to identify and quantify essential habitat characteristics for ecosystem health and valuation methods to predict ecosystem response to restoration actions. This process is …","https://www.sciencedirect.com/science/article/pii/S030438002100082X?casa_token=cMuZufmBF7kAAAAA:waP44aFiivhHrSpukl2qA0QbehY7S6F4vc16QA_hccfHqH1yQzhBF5LIet8c1s4_LvMSz53jnxst","https://scholar.google.com/scholar?q=related:FzUHfaGM1-AJ:scholar.google.com/&scioq=&hl=en&as_sdt=2005&sciodt=0,5"
2,"TBP Jusselme","Data-driven method for low-carbon building design at early stages",2020,"","infoscience.epfl.ch","https://infoscience.epfl.ch/record/276589","https://scholar.google.com/scholar?cites=3774902357124076308&as_sdt=2005&sciodt=0,5&hl=en",187,"2021-09-23 12:35:59","","","","",,,,,2,2.00,2,1,1,"The Paris agreement on climate change called for carbon neutrality as of 2050. The built environment is one of the major contributors to the greenhouse effect, representing 39% of global emissions. As a result, this sector is targeted by green standards and regulations to …","https://infoscience.epfl.ch/record/276589/files/EPFL_TH10122.pdf","https://scholar.google.com/scholar?q=related:FFMqirElYzQJ:scholar.google.com/&scioq=&hl=en&as_sdt=2005&sciodt=0,5"
1,"NH Hsieh, B Reisfeld, WA Chiu","pksensi: An R package to apply global sensitivity analysis in physiologically based kinetic modeling",2020,"SoftwareX","Elsevier","https://www.sciencedirect.com/science/article/pii/S2352711020303228","https://scholar.google.com/scholar?cites=13935972854235818533&as_sdt=2005&sciodt=0,5&hl=en",188,"2021-09-23 12:35:59","HTML","","","",,,,,1,1.00,0,3,1,"Sensitivity analysis (SA) is an essential tool for modelers to understand the influence of model parameters on model outputs. It is also increasingly used in developing and assessing physiologically based kinetic (PBK) models. For instance, several studies have …","https://www.sciencedirect.com/science/article/pii/S2352711020303228","https://scholar.google.com/scholar?q=related:JWo2mHmFZsEJ:scholar.google.com/&scioq=&hl=en&as_sdt=2005&sciodt=0,5"
1,"Z Shi, JA Fonseca, A Schlueter","Floor area density and land uses for efficient district cooling systems in high-density cities",2021,"Sustainable Cities and Society","Elsevier","https://www.sciencedirect.com/science/article/pii/S2210670720308180","https://scholar.google.com/scholar?cites=16436403531538079131&as_sdt=2005&sciodt=0,5&hl=en",189,"2021-09-23 12:35:59","HTML","","","",,,,,1,1.00,0,3,1,"Floor area density and land uses are two fundamental parameters of a city's master plan. Both affect the spatial and temporal distribution of the cooling demand in a district. This work studies how floor area density and land use impact the efficiency of district cooling systems …","https://www.sciencedirect.com/science/article/pii/S2210670720308180","https://scholar.google.com/scholar?q=related:m51Nmu3VGeQJ:scholar.google.com/&scioq=&hl=en&as_sdt=2005&sciodt=0,5"
1,"T Iwanaga, X Sun, Q Wang, JHA Guillaume…","Property-based Sensitivity Analysis: An approach to identify model implementation and integration errors",2021,"… Modelling & Software","Elsevier","https://www.sciencedirect.com/science/article/pii/S1364815221000566?casa_token=yf0Tm96ciTMAAAAA:1AzKbstdkDqCvWZ8dRu9VPGPInaOrmRpAuypFiBm0G8CVFXrSnree_Dc3Mp0j-gl4jF2ujUx_LTt","https://scholar.google.com/scholar?cites=17616410358393821488&as_sdt=2005&sciodt=0,5&hl=en",190,"2021-09-23 12:35:59","HTML","","","",,,,,1,1.00,0,5,1,"Diagnostic testing is an oft-recommended use of sensitivity analysis to assess correctness or plausibility of model behavior. In this paper we demonstrate the use of sensitivity analysis as a complementary first-pass software test for the validation of model behavior. Typical testing …","https://www.sciencedirect.com/science/article/pii/S1364815221000566?casa_token=yf0Tm96ciTMAAAAA:1AzKbstdkDqCvWZ8dRu9VPGPInaOrmRpAuypFiBm0G8CVFXrSnree_Dc3Mp0j-gl4jF2ujUx_LTt","https://scholar.google.com/scholar?q=related:MFmTneIPevQJ:scholar.google.com/&scioq=&hl=en&as_sdt=2005&sciodt=0,5"
1,"Y Fang, X Song, H Ren, WA Perkins…","High-performance simulation of dynamic hydrologic exchange and implications for surrogate flow and reactive transport modeling in a large river corridor",2020,"Frontiers in …","internal-journal.frontiersin.org","https://internal-journal.frontiersin.org/articles/10.3389/frwa.2020.564211/full","https://scholar.google.com/scholar?cites=12261390033767661512&as_sdt=2005&sciodt=0,5&hl=en",191,"2021-09-23 12:35:59","HTML","","","",,,,,1,1.00,0,5,1,"Hydrologic exchange flows (HEFs) have environmental significance in riverine ecosystems. Key river channel factors that influence the spatial and temporal variations of HEFs include river stage, riverbed morphology, and riverbed hydraulic conductivity. However, their …","https://internal-journal.frontiersin.org/articles/10.3389/frwa.2020.564211/full","https://scholar.google.com/scholar?q=related:yH88p0U1KaoJ:scholar.google.com/&scioq=&hl=en&as_sdt=2005&sciodt=0,5"
1,"K Otto, J Wang, T Uyan","Using open source code libraries for robust design analysis",2019,"Proceedings of the Design Society …","cambridge.org","https://www.cambridge.org/core/journals/proceedings-of-the-international-conference-on-engineering-design/article/using-open-source-code-libraries-for-robust-design-analysis/21109634640FD90B11CF7D5B1846201F","https://scholar.google.com/scholar?cites=1695728347751485765&as_sdt=2005&sciodt=0,5&hl=en",192,"2021-09-23 12:35:59","","","","",,,,,1,0.50,0,3,2,"The design of systems today often involves computer simulation to assess performance and design margins. Understanding how variability erases design margin is important to assure adequacy of margins, especially in optimization efforts. In this paper, we develop a toolchain …","https://www.cambridge.org/core/services/aop-cambridge-core/content/view/21109634640FD90B11CF7D5B1846201F/S2220434219001793a.pdf/using_open_source_code_libraries_for_robust_design_analysis.pdf","https://scholar.google.com/scholar?q=related:RZFJq_JviBcJ:scholar.google.com/&scioq=&hl=en&as_sdt=2005&sciodt=0,5"
3,"M Abdelbaky, JR Peeters, W Dewulf","On the influence of second use, future battery technologies, and battery lifetime on the maximum recycled content of future electric vehicle batteries in Europe",2021,"Waste Management","Elsevier","https://www.sciencedirect.com/science/article/pii/S0956053X2100101X?casa_token=HFlqvRX8a6wAAAAA:8xaprWIp0dwbV6pu3hjtMGGExEjTtfkjyb7NxlOuAazxWbgtW9ert5UwsAl-4ptXBfz_jL-Z3rA5","https://scholar.google.com/scholar?cites=12046992619414114498&as_sdt=2005&sciodt=0,5&hl=en",193,"2021-09-23 12:35:59","HTML","","","",,,,,3,3.00,1,3,1,"Abstract The European Union is promoting the uptake of low emission vehicles to reduce greenhouse gas emissions from transportation. However, this transition will increase the demand for five important battery raw materials; ie lithium, nickel, cobalt, copper, and …","https://www.sciencedirect.com/science/article/pii/S0956053X2100101X?casa_token=HFlqvRX8a6wAAAAA:8xaprWIp0dwbV6pu3hjtMGGExEjTtfkjyb7NxlOuAazxWbgtW9ert5UwsAl-4ptXBfz_jL-Z3rA5","https://scholar.google.com/scholar?q=related:wlDuq_WDL6cJ:scholar.google.com/&scioq=&hl=en&as_sdt=2005&sciodt=0,5"
3,"AM Elias, AA Longati, R de Campos Giordano…","Retro-techno-economic-environmental analysis improves the operation efficiency of 1G-2G bioethanol and bioelectricity facilities",2021,"Applied Energy","Elsevier","https://www.sciencedirect.com/science/article/pii/S0306261920315488?casa_token=bg2cCsqei0UAAAAA:xc4OqmjbRIAyzLAysmS-So3wATjd5Dn6DxwMP3qdtzn6Bnf34hkM34aNo59lWaRYdCfMItPgE2oF","https://scholar.google.com/scholar?cites=7165101614248868995&as_sdt=2005&sciodt=0,5&hl=en",194,"2021-09-23 12:35:59","HTML","","","",,,,,3,3.00,1,4,1,"In order to assess the feasibility of new, environmentally friendly technologies for energy generation in a neutral carbon economy, economic and environmental metrics must be simultaneously assessed. Retro-Techno-Economic-Environmental Analysis (RTEEA) is a …","https://www.sciencedirect.com/science/article/pii/S0306261920315488?casa_token=bg2cCsqei0UAAAAA:xc4OqmjbRIAyzLAysmS-So3wATjd5Dn6DxwMP3qdtzn6Bnf34hkM34aNo59lWaRYdCfMItPgE2oF","https://scholar.google.com/scholar?q=related:g7zhsPSNb2MJ:scholar.google.com/&scioq=&hl=en&as_sdt=2005&sciodt=0,5"
2,"M Rausch, WH Sanders","Sensitivity Analysis and Uncertainty Quantification of State-Based Discrete-Event Simulation Models Through a Stacked Ensemble of Metamodels",2020,"International Conference on Quantitative …","Springer","https://link.springer.com/chapter/10.1007/978-3-030-59854-9_20","https://scholar.google.com/scholar?cites=14499073737693386735&as_sdt=2005&sciodt=0,5&hl=en",195,"2021-09-23 12:35:59","","10.1007/978-3-030-59854-9_20","","",,,,,2,2.00,1,2,1,"Realistic state-based discrete-event simulation models are often quite complex. The complexity frequently manifests in models that (a) contain a large number of input variables whose values are difficult to determine precisely, and (b) take a relatively long time to solve …","https://www.perform.illinois.edu/Papers/USAN_papers/20RAU01.pdf","https://scholar.google.com/scholar?q=related:79dou74ON8kJ:scholar.google.com/&scioq=&hl=en&as_sdt=2005&sciodt=0,5"
1,"SE Champer, N Oakes, R Sharma, P García-Díaz…","Modeling CRISPR gene drives for suppression of invasive rodents",2020,"BioRxiv","biorxiv.org","https://www.biorxiv.org/content/10.1101/2020.11.05.369942v1.abstract","https://scholar.google.com/scholar?cites=8802820408760618141&as_sdt=2005&sciodt=0,5&hl=en",196,"2021-09-23 12:35:59","","10.1101/2020.11.05.369942v1.abstract","","",,,,,1,1.00,0,5,1,"Invasive rodent populations pose a threat to biodiversity across the globe. When confronted with these new invaders, native species that evolved independently are often defenseless. CRISPR gene drive systems could provide a solution to this problem by spreading …","https://www.biorxiv.org/content/biorxiv/early/2020/11/06/2020.11.05.369942.full.pdf","https://scholar.google.com/scholar?q=related:nUy8vYXmKXoJ:scholar.google.com/&scioq=&hl=en&as_sdt=2005&sciodt=0,5"
4,"MM Rajabi, M Fahs, A Panjehfouladgaran…","Uncertainty quantification and global sensitivity analysis of double-diffusive natural convection in a porous enclosure",2020,"International Journal of …","Elsevier","https://www.sciencedirect.com/science/article/pii/S0017931020332270?casa_token=dsUej9TkayUAAAAA:y4DOCB3q-ffsHJZuVmzkyXyX6T0_ZNwaoNksAzveUsx1jYL6AVqrtOKuyN23BKsR_dB3p7fOhiVp","https://scholar.google.com/scholar?cites=10487438673985706324&as_sdt=2005&sciodt=0,5&hl=en",197,"2021-09-23 12:35:59","HTML","","","",,,,,4,4.00,1,4,1,"In this paper, detailed uncertainty propagation analysis (UPA) and variance-based global sensitivity analysis (GSA) are performed on the widely adopted double-diffuse convection (DDC) benchmark problem of a square porous cavity with horizontal temperature and …","https://www.sciencedirect.com/science/article/pii/S0017931020332270?casa_token=dsUej9TkayUAAAAA:y4DOCB3q-ffsHJZuVmzkyXyX6T0_ZNwaoNksAzveUsx1jYL6AVqrtOKuyN23BKsR_dB3p7fOhiVp","https://scholar.google.com/scholar?q=related:VJmcvujdipEJ:scholar.google.com/&scioq=&hl=en&as_sdt=2005&sciodt=0,5"
1,"RK Veiga, AC Veloso, AP Melo, R Lamberts","Application of machine learning to estimate building energy use intensities",2021,"Energy and Buildings","Elsevier","https://www.sciencedirect.com/science/article/pii/S037877882100503X?casa_token=xHIr2uJLki8AAAAA:pt8obnMGZLlqnE5dnPXaI1Fpl8P31vMxFgMc5zpqhHJToNNj1Qk_rO4fhuCboTbOU-56d5ZdkFpR","https://scholar.google.com/scholar?cites=12028477629945208217&as_sdt=2005&sciodt=0,5&hl=en",198,"2021-09-23 12:35:59","HTML","","","",,,,,1,1.00,0,4,1,"Abstract Information on building energy consumption and its characteristics is essential for carrying out benchmarking processes. However, currently a lack of data acts as a major barrier in this regard. To address this issue, the purpose of this study is to demonstrate the …","https://www.sciencedirect.com/science/article/pii/S037877882100503X?casa_token=xHIr2uJLki8AAAAA:pt8obnMGZLlqnE5dnPXaI1Fpl8P31vMxFgMc5zpqhHJToNNj1Qk_rO4fhuCboTbOU-56d5ZdkFpR",""
2,"S Chinta, J Yaswanth Sai, C Balaji","Assessment of WRF model parameter sensitivity for high‐intensity precipitation events during the Indian summer monsoon",2020,"Earth and Space Science","Wiley Online Library","https://agupubs.onlinelibrary.wiley.com/doi/abs/10.1029/2020EA001471","https://scholar.google.com/scholar?cites=18433406657444360996&as_sdt=2005&sciodt=0,5&hl=en",199,"2021-09-23 12:35:59","","10.1029/2020EA001471","","",,,,,2,2.00,1,3,1,"Default values for many parameters in Numerical Weather Prediction models are typically adopted based on theoretical or experimental investigations by scheme designers. Short‐range forecasts are substantially affected by the specification of parameters in the Weather …","https://agupubs.onlinelibrary.wiley.com/doi/pdf/10.1029/2020EA001471","https://scholar.google.com/scholar?q=related:JLNKybCd0P8J:scholar.google.com/&scioq=&hl=en&as_sdt=2005&sciodt=0,5"
1,"E Morelle, A Rudolph, C McHardy, C Rauh","Detection and prediction of foam evolution during the bottling of noncarbonated beverages using artificial neural networks",2021,"Food and Bioproducts …","Elsevier","https://www.sciencedirect.com/science/article/pii/S0960308521000614?casa_token=NHlS6kwFUjsAAAAA:AzHlJA5A6qfPeT_X5cydk23npVPqwInO7euxhhjPEriN9l-Rkpde1kEoNSmXXOkk2QXxlOl4XdvT","https://scholar.google.com/scholar?cites=3001239599832626697&as_sdt=2005&sciodt=0,5&hl=en",200,"2021-09-23 12:35:59","HTML","","","",,,,,1,1.00,0,4,1,"Foams are relevant in many food products and food production processes. During the bottling of beverages, foam can severely impair the process as overflowing foam causes underfilled bottles and poses a high contamination risk. Consequently, the filling speed is …","https://www.sciencedirect.com/science/article/pii/S0960308521000614?casa_token=NHlS6kwFUjsAAAAA:AzHlJA5A6qfPeT_X5cydk23npVPqwInO7euxhhjPEriN9l-Rkpde1kEoNSmXXOkk2QXxlOl4XdvT","https://scholar.google.com/scholar?q=related:CfbbyYOLpikJ:scholar.google.com/&scioq=&hl=en&as_sdt=2005&sciodt=0,5"
2,"NJ Lyons, P Val, JS Albert, JK Willenbring…","Topographic controls on divide migration, stream capture, and diversification in riverine life",2020,"Earth Surface …","esurf.copernicus.org","https://esurf.copernicus.org/articles/8/893/2020/","https://scholar.google.com/scholar?cites=8330182871778570749&as_sdt=2005&sciodt=0,5&hl=en",201,"2021-09-23 12:35:59","HTML","","","",,,,,2,2.00,0,5,1,"Drainages reorganise in landscapes under diverse conditions and process dynamics that impact biotic distributions and evolution. We first investigated the relative control that Earth surface process parameters have on divide migration and stream capture in scenarios of …","https://esurf.copernicus.org/articles/8/893/2020/","https://scholar.google.com/scholar?q=related:_bFnyi_BmnMJ:scholar.google.com/&scioq=&hl=en&as_sdt=2005&sciodt=0,5"
1,"J Torres, I Bogdanov, M Boisson","A Modeling Workflow for Geological Carbon Storage Integrated with Coupled Flow and Geomechanics Simulations",2020,"ECMOR XVII","earthdoc.org","https://www.earthdoc.org/content/papers/10.3997/2214-4609.202035154","https://scholar.google.com/scholar?cites=12730259515151759342&as_sdt=2005&sciodt=0,5&hl=en",202,"2021-09-23 12:35:59","","10.3997/2214-4609.202035154","","",,,,,1,1.00,0,3,1,"Summary Geological Carbon Storage (GCS) is called to play a critical role for accelerating the transition toward a lowcarbon economy during the remainder of the century. However, for making a significant contribution, GCS targets should be scaled-up from megatons (per …","","https://scholar.google.com/scholar?q=related:7jcoy5T3qrAJ:scholar.google.com/&scioq=&hl=en&as_sdt=2005&sciodt=0,5"
1,"D Degen, K Veroy, F Wellmann","Uncertainty Quantification for Basin-Scale Conductive Models",2020,"Earth and Space Science Open …","researchgate.net","https://www.researchgate.net/profile/Florian-Wellmann/publication/345373989_Uncertainty_Quantification_for_Basin-Scale_Conductive_Models/links/600a5bb7a6fdccdcb86fdc6c/Uncertainty-Quantification-for-Basin-Scale-Conductive-Models.pdf","https://scholar.google.com/scholar?cites=7367753775337730056&as_sdt=2005&sciodt=0,5&hl=en",203,"2021-09-23 12:35:59","PDF","","","",,,,,1,1.00,0,3,1,"Abstract 16 Geophysical simulations are commonly used in many scientific studies. Especially in com-17 plex simulations, it is still common practice to provide a single deterministic outcome. 18 Often, a probabilistic approach would be preferable, as a way to …","https://www.researchgate.net/profile/Florian-Wellmann/publication/345373989_Uncertainty_Quantification_for_Basin-Scale_Conductive_Models/links/600a5bb7a6fdccdcb86fdc6c/Uncertainty-Quantification-for-Basin-Scale-Conductive-Models.pdf","https://scholar.google.com/scholar?q=related:CHCMywWFP2YJ:scholar.google.com/&scioq=&hl=en&as_sdt=2005&sciodt=0,5"
1,"H Feng, T Xu, L Liu, S Zhou, J Zhao, S Liu, Z Xu…","Modeling Transpiration with Sun-Induced Chlorophyll Fluorescence Observations via Carbon-Water Coupling Methods",2021,"Remote Sensing","mdpi.com","https://www.mdpi.com/1007710","https://scholar.google.com/scholar?cites=17341295606251265856&as_sdt=2005&sciodt=0,5&hl=en",204,"2021-09-23 12:35:59","","","","",,,,,1,1.00,0,8,1,"Successfully applied in the carbon research area, sun-induced chlorophyll fluorescence (SIF) has raised the interest of researchers from the water research domain. However, current works focused on the empirical relationship between SIF and plant transpiration (T) …","https://www.mdpi.com/2072-4292/13/4/804/pdf","https://scholar.google.com/scholar?q=related:QB-my3moqPAJ:scholar.google.com/&scioq=&hl=en&as_sdt=2005&sciodt=0,5"
1,"D Degen, C Spooner…","How biased are our models?–A Case Study of the Alpine Region",2021,"Geoscientific Model …","gmd.copernicus.org","https://gmd.copernicus.org/preprints/gmd-2021-48/","https://scholar.google.com/scholar?cites=13995176651425253550&as_sdt=2005&sciodt=0,5&hl=en",205,"2021-09-23 12:35:59","","","","",,,,,1,1.00,0,3,1,"Geophysical process simulations play a crucial role in the understanding of the subsurface. This understanding is required to provide, for instance, clean energy sources such as geothermal energy. However, the calibration and validation of the physical models heavily …","https://gmd.copernicus.org/preprints/gmd-2021-48/gmd-2021-48.pdf","https://scholar.google.com/scholar?q=related:rggLzQPbOMIJ:scholar.google.com/&scioq=&hl=en&as_sdt=2005&sciodt=0,5"
1,"L Fan, L Li, Y Su, M Cai, M Tang, X Gao, Z Chen…","CO2-prepad injection EOR simulation and sensitivity analysis considering miscibility and geomechanics in tight oil reservoirs",2020,"Journal of Petroleum …","Elsevier","https://www.sciencedirect.com/science/article/pii/S092041052030961X?casa_token=E_79IWNjwUgAAAAA:mSOj_qCJ3nu5SaEurmZFxxR4JDq5thJgbxljC2bXsPHIisD2kx2UaTSwA1Z4CtxVD7b8MSukaqHf","https://scholar.google.com/scholar?cites=3449583663946658436&as_sdt=2005&sciodt=0,5&hl=en",206,"2021-09-23 12:35:59","HTML","","","",,,,,1,1.00,0,8,1,"Injecting CO 2 pre-pad into tight reservoirs before hydraulic fracturing is a promising way to improve the productivity of single well. In this method, CO 2 should be injected into the formation at a high rate. Also the miscibility of CO 2 and oil with the changes of intricate …","https://www.sciencedirect.com/science/article/pii/S092041052030961X?casa_token=E_79IWNjwUgAAAAA:mSOj_qCJ3nu5SaEurmZFxxR4JDq5thJgbxljC2bXsPHIisD2kx2UaTSwA1Z4CtxVD7b8MSukaqHf","https://scholar.google.com/scholar?q=related:hPKH0BBi3y8J:scholar.google.com/&scioq=&hl=en&as_sdt=2005&sciodt=0,5"
2,"EA Moallemi, S Eker, L Gao, M Hadjikakou…","Global pathways to sustainable development to 2030 and beyond",2020,"arXiv preprint arXiv …","arxiv.org","https://arxiv.org/abs/2012.04333","https://scholar.google.com/scholar?cites=13723178966797459867&as_sdt=2005&sciodt=0,5&hl=en",207,"2021-09-23 12:35:59","","","","",,,,,2,2.00,0,5,1,"Progress to-date towards the UN Agenda 2030 has fallen short of expectations. We undertake a model-based global integrated assessment to project future progress by 2030, 2050, and 2100 and to characterise the transformations needed to deliver the global …","https://arxiv.org/pdf/2012.04333","https://scholar.google.com/scholar?q=related:myET0Y-Gcr4J:scholar.google.com/&scioq=&hl=en&as_sdt=2005&sciodt=0,5"
1,"R Talami, JA Jakubiec","Sensitivity of design parameters on energy, system and comfort performances for radiant cooled office buildings in the tropics",2019,"","researchgate.net","https://www.researchgate.net/profile/J-Jakubiec/publication/335700235_Sensitivity_Of_Design_Parameters_On_Energy_System_And_Comfort_Performances_For_Radiant_Cooled_Office_Buildings_In_The_Tropics/links/5d7652fb92851cacdb2ca7e6/Sensitivity-Of-Design-Parameters-On-Energy-System-And-Comfort-Performances-For-Radiant-Cooled-Office-Buildings-In-The-Tropics.pdf","https://scholar.google.com/scholar?cites=7476528366311840893&as_sdt=2005&sciodt=0,5&hl=en",208,"2021-09-23 12:35:59","PDF","","","",,,,,1,0.50,1,2,2,"The research community has worked on optimizing the design, performance, and operation of radiant system technologies; however, the holistic interactions between architectural design decisions and radiant cooling systems design in the tropics have been left …","https://www.researchgate.net/profile/J-Jakubiec/publication/335700235_Sensitivity_Of_Design_Parameters_On_Energy_System_And_Comfort_Performances_For_Radiant_Cooled_Office_Buildings_In_The_Tropics/links/5d7652fb92851cacdb2ca7e6/Sensitivity-Of-Design-Parameters-On-Energy-System-And-Comfort-Performances-For-Radiant-Cooled-Office-Buildings-In-The-Tropics.pdf","https://scholar.google.com/scholar?q=related:fRwm0-_2wWcJ:scholar.google.com/&scioq=&hl=en&as_sdt=2005&sciodt=0,5"
1,"A Bhaskar, M Assadi, HN Somehsaraei","Can methane pyrolysis based hydrogen production lead to the decarbonisation of iron and steel industry?",2021,"Energy Conversion and …","Elsevier","https://www.sciencedirect.com/science/article/pii/S2590174521000040","https://scholar.google.com/scholar?cites=2006674574747237054&as_sdt=2005&sciodt=0,5&hl=en",209,"2021-09-23 12:35:59","HTML","","","",,,,,1,1.00,0,3,1,"Decarbonisation of the iron and steel industry would require the use of innovative low-carbon production technologies. Use of 100% hydrogen in a shaft furnace (SF) to reduce iron ore has the potential to reduce emissions from iron and steel production significantly. In …","https://www.sciencedirect.com/science/article/pii/S2590174521000040","https://scholar.google.com/scholar?q=related:vvqd1-Qj2RsJ:scholar.google.com/&scioq=&hl=en&as_sdt=2005&sciodt=0,5"
3,"P Schön, U Krewer","Revealing the complex sulfur reduction mechanism using cyclic voltammetry simulation",2021,"Electrochimica Acta","Elsevier","https://www.sciencedirect.com/science/article/pii/S0013468620319162?casa_token=OgYO_p6g27oAAAAA:OxS5hkhAVrafYUAKq-UzoiOmTo_-WufXup0r1NLdpwzb85WFuu-i41jXNIr6qDsBM-9DXzy8wFSG","https://scholar.google.com/scholar?cites=15159797381085263425&as_sdt=2005&sciodt=0,5&hl=en",210,"2021-09-23 12:35:59","HTML","","","",,,,,3,3.00,2,2,1,"Understanding the complex reaction mechanism and kinetics of sulfur reduction is prerequisite to design well performing lithium-sulfur batteries. Decoupling of individual polysulfide species is problematic when only using experimental methods. Model supported …","https://www.sciencedirect.com/science/article/pii/S0013468620319162?casa_token=OgYO_p6g27oAAAAA:OxS5hkhAVrafYUAKq-UzoiOmTo_-WufXup0r1NLdpwzb85WFuu-i41jXNIr6qDsBM-9DXzy8wFSG","https://scholar.google.com/scholar?q=related:QfZ75mVrYtIJ:scholar.google.com/&scioq=&hl=en&as_sdt=2005&sciodt=0,5"
1,"V Gabriele-Rivet, MP Ward, J Arsenault…","Could a rabies incursion spread in the northern Australian dingo population? Development of a spatial stochastic simulation model",2021,"PLoS neglected …","journals.plos.org","https://journals.plos.org/plosntds/article?id=10.1371/journal.pntd.0009124","https://scholar.google.com/scholar?cites=9739907940451657885&as_sdt=2005&sciodt=0,5&hl=en",211,"2021-09-23 12:35:59","HTML","","","",,,,,1,1.00,0,4,1,"Australia, home to the iconic dingo, is currently free from canine rabies. However northern Australia, including Indigenous communities with large free-roaming domestic dog populations, is at increased risk of rabies incursion from nearby Indonesia. We developed a …","https://journals.plos.org/plosntds/article?id=10.1371/journal.pntd.0009124","https://scholar.google.com/scholar?q=related:naig56oaK4cJ:scholar.google.com/&scioq=&hl=en&as_sdt=2005&sciodt=0,5"
