Cites,Authors,Title,Year,Source,Publisher,ArticleURL,CitesURL,GSRank,QueryDate,Type,DOI,ISSN,CitationURL,Volume,Issue,StartPage,EndPage,ECC,CitesPerYear,CitesPerAuthor,AuthorCount,Age,Abstract,FullTextURL,RelatedURL
0,"A Murali","Data-Driven Robotic Grasping in the Wild",2020,"","search.proquest.com","https://search.proquest.com/openview/a5e42d3aa865cde75fdbe8c5207c5efb/1?pq-origsite=gscholar&cbl=18750&diss=y","",244,"2021-06-03 16:24:07","HTML","","","",,,,,0,0.00,0,1,1,"Robotic grasping has seen tremendous advancements in recent years. Yet, the current paradigm of manipulation research is typically some form of table-top manipulation in constrained setups or in simulation. Building general purpose personal robots that can …","https://search.proquest.com/openview/a5e42d3aa865cde75fdbe8c5207c5efb/1?pq-origsite=gscholar&cbl=18750&diss=y",""
0,"C Ashraf, J Pfaendtner","Assessing the Performance of Various Stochastic Optimization Methods on Chemical Kinetic Modeling of Combustion",2020,"Industrial & Engineering Chemistry …","ACS Publications","https://pubs.acs.org/doi/abs/10.1021/acs.iecr.0c04009","",245,"2021-06-03 16:24:07","","10.1021/acs.iecr.0c04009","","",,,,,0,0.00,0,2,1,"The solution to chemical kinetic models for a particular reactor configuration is usually composed of a set of stiff ordinary differential equations (ODEs), where a number of rate parameters have to be estimated to fit with experimental observations. This presents a …","https://pubs.acs.org/doi/full/10.1021/acs.iecr.0c04009","https://scholar.google.com/scholar?q=related:0OC-YIWHc_MJ:scholar.google.com/&scioq=&hl=en&as_sdt=2005&sciodt=0,5"
0,"A Serbouti, M Rattal, EM Oualim…","Innovative time efficient method to optimize buildings' performance using Design of Experiment, Polynomial Regression and Genetic Algorithms",2021,"Journal of Physics …","iopscience.iop.org","https://iopscience.iop.org/article/10.1088/1742-6596/1714/1/012014/meta","",246,"2021-06-03 16:24:07","","","","",,,,,0,0.00,0,4,1,"Dynamic thermal simulation use is essential for studying complex building systems. One of the major challenges to widely deploy optimization in this field'engineering and research is the high computational cost to perform the required simulation-based iterations. To …","https://iopscience.iop.org/article/10.1088/1742-6596/1714/1/012014/pdf","https://scholar.google.com/scholar?q=related:_DOtYY9_q1kJ:scholar.google.com/&scioq=&hl=en&as_sdt=2005&sciodt=0,5"
0,"J Student, MR Kramer, P Steinmann","Coasting: Model description, global sensitivity analysis, and scenario discovery",2020,"MethodsX","Elsevier","https://www.sciencedirect.com/science/article/pii/S2215016120303654","",247,"2021-06-03 16:24:07","HTML","","","",,,,,0,0.00,0,3,1,"This manuscript provides information for replicating the Coasting agent-based model presented in “Simulating emerging coastal tourism vulnerabilities: an agent-based modelling approach”. The model description follows the Overview, Design Concepts, and …","https://www.sciencedirect.com/science/article/pii/S2215016120303654","https://scholar.google.com/scholar?q=related:Z0yeZqcvyyAJ:scholar.google.com/&scioq=&hl=en&as_sdt=2005&sciodt=0,5"
0,"O Marko","Application of Innovative Methods of Machine Learning in Biosystems",2019,"","search.proquest.com","https://search.proquest.com/openview/79bd3c7785e595d9a2a6801ebe957844/1?pq-origsite=gscholar&cbl=18750&diss=y","",248,"2021-06-03 16:24:07","HTML","","","",,,,,0,0.00,0,1,2,"The topic of the research in this dissertation is the application of machine learning in solving problems characteristic to biosystems, with special emphasis on agriculture. Firstly, an innovative regression algorithm based on big data was presented, that was used for yield …","https://search.proquest.com/openview/79bd3c7785e595d9a2a6801ebe957844/1?pq-origsite=gscholar&cbl=18750&diss=y","https://scholar.google.com/scholar?q=related:LQ1laPlOKZMJ:scholar.google.com/&scioq=&hl=en&as_sdt=2005&sciodt=0,5"
0,"D Weisz-Patrault, C Francart, G Seisson","Uncertainty estimation and hierarchical Bayesian analysis of mechanical dynamic tests",2021,"Journal of Dynamic Behavior of …","Springer","https://link.springer.com/article/10.1007/s40870-020-00280-6","",249,"2021-06-03 16:24:07","HTML","10.1007/s40870-020-00280-6","","",,,,,0,0.00,0,3,1,"A methodology is presented to quantify uncertainties resulting from the analysis of dynamic tests performed on classic split Hopkinson pressure bar system in order to improve material parameter estimation within the framework of Bayesian inference. Since the experimental …","https://link.springer.com/article/10.1007/s40870-020-00280-6","https://scholar.google.com/scholar?q=related:FdB2bZtbeq8J:scholar.google.com/&scioq=&hl=en&as_sdt=2005&sciodt=0,5"
5,"J Lakhlili, O Hoenen, OO Luk, DP Coster","Uncertainty Quantification for Multiscale Fusion Plasma Simulations with VECMA Toolkit",2020,"International Conference on …","Springer","https://link.springer.com/chapter/10.1007/978-3-030-50436-6_53","https://scholar.google.com/scholar?cites=13161353094869467654&as_sdt=2005&sciodt=0,5&hl=en",250,"2021-06-03 16:24:07","HTML","10.1007/978-3-030-50436-6_53","","",,,,,5,5.00,1,4,1,"Within VECMAtk platform we perform Uncertainty Quantification (UQ) for multiscale fusion plasmas simulations. The goal of VECMAtk is to enable modular and automated tools for a wide range of applications to archive robust and actionable results. Our aim in the current …","https://link.springer.com/chapter/10.1007/978-3-030-50436-6_53","https://scholar.google.com/scholar?q=related:BsIub-iEprYJ:scholar.google.com/&scioq=&hl=en&as_sdt=2005&sciodt=0,5"
0,"P Oleśkiewicz, CM Baugh","Sensitivity analysis of a galaxy formation model",2020,"Monthly Notices of the Royal …","academic.oup.com","https://academic.oup.com/mnras/article-abstract/493/2/1827/5682498","",251,"2021-06-03 16:24:07","","","","",,,,,0,0.00,0,2,1,"We present the first application of a variance-based sensitivity analysis (SA) to a model that aims to predict the evolution and properties of the whole galaxy population. SA is a well-established technique in other quantitative sciences, but is a relatively novel tool for the …","https://academic.oup.com/mnras/article/493/2/1827/5682498","https://scholar.google.com/scholar?q=related:L2Rob8o-zBcJ:scholar.google.com/&scioq=&hl=en&as_sdt=2005&sciodt=0,5"
0,"R Jayapalan-Nair, E Brembilla, C Hopfe, J Mardaljevic","Influence of building design on occupant comfort in adaptive climate zones",,"repository.lboro.ac.uk","","https://repository.lboro.ac.uk/articles/conference%20contribution/Influence_of_building_design_on_occupant_comfort_in_adaptive_climate_zones/12017076/1","",252,"2021-06-03 16:24:07","","","","",,,,,0,0.00,0,4,,"The responsiveness of buildings to prevailing local climate plays an important role if the dual aspects of occupant comfort and low energy demand are to be met. This study takes as example the State of Kerala in India where the Government–as part of the project titled …","https://repository.lboro.ac.uk/articles/conference_contribution/Influence_of_building_design_on_occupant_comfort_in_adaptive_climate_zones/12017076/files/22079697.pdf","https://scholar.google.com/scholar?q=related:B8eScNUWEUsJ:scholar.google.com/&scioq=&hl=en&as_sdt=2005&sciodt=0,5"
0,"L Conibear, CL Reddington, BJ Silver, Y Chen…","Statistical emulation of winter ambient fine particulate matter concentrations from emission changes in China",2021,"…","Wiley Online Library","https://agupubs.onlinelibrary.wiley.com/doi/abs/10.1029/2021GH000391","",253,"2021-06-03 16:24:07","","10.1029/2021GH000391","","",,,,,0,0.00,0,5,1,"Air pollution exposure remains a leading public health problem in China. The use of chemical transport models to quantify the impacts of various emission changes on air quality is limited by their large computational demands. Machine learning models can emulate …","https://agupubs.onlinelibrary.wiley.com/doi/pdfdirect/10.1029/2021GH000391",""
0,"M Rabe, AA Juan, N Mustafee, A Skoogh, S Jain…","JUST-IN-TIME PARALLEL SIMULATION",,"publish.illinois.edu","","http://publish.illinois.edu/science-of-security-lablet/files/2019/01/Just-In-Time-Parallel-Siumlation.pdf","",254,"2021-06-03 16:24:07","PDF","","","",,,,,0,0.00,0,6,,"Due to the evolution of programming languages, interpreted languages have gained widespread use in scientific and research computing. Interpreted languages excel at being portable, easy to use, and fast in prototyping than their ahead-of-time (AOT) counterparts …","http://publish.illinois.edu/science-of-security-lablet/files/2019/01/Just-In-Time-Parallel-Siumlation.pdf","https://scholar.google.com/scholar?q=related:Hv97cgTgf8kJ:scholar.google.com/&scioq=&hl=en&as_sdt=2005&sciodt=0,5"
1,"TN Portone","Representing model-form uncertainty from missing microstructural information",2019,"","repositories.lib.utexas.edu","https://repositories.lib.utexas.edu/handle/2152/83112","https://scholar.google.com/scholar?cites=3105704885346802734&as_sdt=2005&sciodt=0,5&hl=en",255,"2021-06-03 16:24:07","","","","",,,,,1,0.50,1,1,2,"A common challenge in modeling multiscale phenomena lies in representing the dependence of macroscopic quantities on microscale dynamics. Incomplete information or limitations in computational resources make it impossible to resolve the microscale …","https://repositories.lib.utexas.edu/bitstream/handle/2152/83112/PORTONE-DISSERTATION-2019.pdf?sequence=1","https://scholar.google.com/scholar?q=related:LpxKdCOuGSsJ:scholar.google.com/&scioq=&hl=en&as_sdt=2005&sciodt=0,5"
0,"DJ Sullivan, X Wu, NR Gallo…","Sensitivity analysis of effective transverse shear viscoelastic and diffusional properties of myelinated white matter",2021,"Physics in Medicine …","iopscience.iop.org","https://iopscience.iop.org/article/10.1088/1361-6560/aba0cc/meta","",256,"2021-06-03 16:24:07","HTML","","","",,,,,0,0.00,0,4,1,"Motivated by the need to interpret the results from a combined use of in vivo brain Magnetic Resonance Elastography (MRE) and Diffusion Tensor Imaging (DTI), we developed a computational framework to study the sensitivity of single-frequency MRE and DTI metrics to …","https://iopscience.iop.org/article/10.1088/1361-6560/aba0cc/meta","https://scholar.google.com/scholar?q=related:fhuIdoRieCgJ:scholar.google.com/&scioq=&hl=en&as_sdt=2005&sciodt=0,5"
0,"T Portone, RD Moser","Bayesian inference of an uncertain generalized diffusion operator",2021,"arXiv preprint arXiv:2105.01807","arxiv.org","https://arxiv.org/abs/2105.01807","",257,"2021-06-03 16:24:07","","","","",,,,,0,0.00,0,2,1,"This paper defines a novel Bayesian inverse problem to infer an infinite-dimensional uncertain operator appearing in a differential equation, whose action on an observable state variable affects its dynamics. The operator is parametrized using its eigendecomposition …","https://arxiv.org/pdf/2105.01807",""
0,"MD Murbach","Linear and Nonlinear Electrochemical Impedance Spectroscopy for Lithium-ion Batteries",2018,"","digital.lib.washington.edu","https://digital.lib.washington.edu/researchworks/handle/1773/42990","",258,"2021-06-03 16:24:07","","","","",,,,,0,0.00,0,1,3,"Whole cell, in situ diagnostics capable of sensitive and selective characterization of the physicochemical processes governing lithium-ion battery performance are critical for improving battery safety, cost, and lifetime. Electrochemical impedance spectroscopy (EIS) is …","https://digital.lib.washington.edu/researchworks/bitstream/handle/1773/42990/Murbach_washington_0250E_19214.pdf?sequence=1","https://scholar.google.com/scholar?q=related:jK9yevDS63AJ:scholar.google.com/&scioq=&hl=en&as_sdt=2005&sciodt=0,5"
0,"FJ Bellido-Leiva, RA Lusardi, JR Lund","Modeling the effect of habitat availability and quality on endangered winter-run Chinook salmon (Oncorhynchus tshawytscha) production in the Sacramento …",2021,"Ecological Modelling","Elsevier","https://www.sciencedirect.com/science/article/pii/S030438002100082X","",259,"2021-06-03 16:24:07","HTML","","","",,,,,0,0.00,0,3,1,"Reconciliation between water uses and sustaining aquatic species populations requires an effort to identify and quantify essential habitat characteristics for ecosystem health and valuation methods to predict ecosystem response to restoration actions. This process is …","https://www.sciencedirect.com/science/article/pii/S030438002100082X",""
0,"A Serbouti, M Rattal, EM Oualim…","An Innovative Multicriteria Decision-Making Tool for Building Performance Optimization",2021,"Engineering, Technology & …","etasr.com","http://etasr.com/index.php/ETASR/article/view/3953","",260,"2021-06-03 16:24:07","","","","",,,,,0,0.00,0,4,1,"Buildings are accountable for nearly 40% of global greenhouse gas emissions. Their overall efficiency is thus a major pillar to optimize energy consumption and to mitigate engendered global warming. The current work takes part in this global dynamic. Indeed, we developed a …","https://etasr.com/index.php/ETASR/article/download/3953/2419",""
0,"IR Sedee","Creating a bias in inspection data",2019,"","","","",261,"2021-06-03 16:24:07","CITATION","","","",,,,,0,0.00,0,1,2,"","","https://scholar.google.com/scholar?q=related:QNFCgAqeP4kJ:scholar.google.com/&scioq=&hl=en&as_sdt=2005&sciodt=0,5"
0,"SB Ramezani, A Amirlatifi, S Rahimi","A novel compartmental model to capture the nonlinear trend of COVID-19",2021,"Computers in Biology and Medicine","Elsevier","https://www.sciencedirect.com/science/article/pii/S0010482521002158","",262,"2021-06-03 16:24:07","HTML","","","",,,,,0,0.00,0,3,1,"The COVID-19 pandemic took the world by surprise and surpassed the expectations of epidemiologists, governments, medical experts, and the scientific community as a whole. The majority of epidemiological models failed to capture the non-linear trend of the …","https://www.sciencedirect.com/science/article/pii/S0010482521002158",""
0,"RKJ Ngo, JW Yeoh, GHW Fan, WKS Loh, CL Poh","BMSS2: a unified database-driven modelling tool for systematic model selection and identifiability analysis",2021,"bioRxiv","biorxiv.org","https://www.biorxiv.org/content/10.1101/2021.02.23.432592v1.abstract","",263,"2021-06-03 16:24:07","","10.1101/2021.02.23.432592v1.abstract","","",,,,,0,0.00,0,5,1,"Modelling in Synthetic Biology constitutes a powerful tool in our continuous search for improved performance with rational Design-Build-Test-Learn approach. In particular, kinetic models unravel system dynamics, enabling system analysis for guiding experimental …","https://www.biorxiv.org/content/biorxiv/early/2021/02/24/2021.02.23.432592.full.pdf",""
0,"D Shaweno, KC Horton, RJ Hayes, PJ Dodd","Assortative social mixing and sex disparities in tuberculosis burden",2021,"Scientific reports","nature.com","https://www.nature.com/articles/s41598-021-86869-w","",264,"2021-06-03 16:24:07","HTML","","","",,,,,0,0.00,0,4,1,"Globally, men have higher tuberculosis (TB) burden but the mechanisms underlying this sex disparity are not fully understood. Recent surveys of social mixing patterns have established moderate preferential within-sex mixing in many settings. This assortative mixing could …","https://www.nature.com/articles/s41598-021-86869-w","https://scholar.google.com/scholar?q=related:_hHVg-d2iFYJ:scholar.google.com/&scioq=&hl=en&as_sdt=2005&sciodt=0,5"
0,"J Aichele","Elastic waves in complex conditions: from the onset of rupture to viscous dispersion in foams",2019,"","researchgate.net","https://www.researchgate.net/profile/Johannes_Aichele/publication/339390951_Elastic_waves_in_complex_conditions_from_the_onset_of_rupture_to_viscous_dispersion_in_foams/links/5e5cfd774585152ce8ff9a60/Elastic-waves-in-complex-conditions-from-the-onset-of-rupture-to-viscous-dispersion-in-foams.pdf","",265,"2021-06-03 16:24:07","PDF","","","",,,,,0,0.00,0,1,2,"This thesis is part of the research at Labtau (Laboratory of therapeutic applications of ultrasound) and ISTerre (Institut des sciences de la terre-earth science institute) at the interface of medical imaging and seismology, two research disciplines that are based on the …","https://www.researchgate.net/profile/Johannes_Aichele/publication/339390951_Elastic_waves_in_complex_conditions_from_the_onset_of_rupture_to_viscous_dispersion_in_foams/links/5e5cfd774585152ce8ff9a60/Elastic-waves-in-complex-conditions-from-the-onset-of-rupture-to-viscous-dispersion-in-foams.pdf","https://scholar.google.com/scholar?q=related:nMDtg0RFIkkJ:scholar.google.com/&scioq=&hl=en&as_sdt=2005&sciodt=0,5"
0,"E Saveleva, V Svitelman, P Blinov, D Valetov","Sensitivity analysis and model calibration as a part of the model development process in radioactive waste disposal safety assessment",2021,"Reliability Engineering & …","Elsevier","https://www.sciencedirect.com/science/article/pii/S095183202100082X","",266,"2021-06-03 16:24:07","HTML","","","",,,,,0,0.00,0,4,1,"Safety assessment and safety case development require uncertainty management as a key part of the confidence-building process. In application to the numerical modelling, the global sensitivity analysis and model calibration tools are widely employed for dealing with …","https://www.sciencedirect.com/science/article/pii/S095183202100082X",""
0,"L Álvarez-Pomar, S Rojas-Galeano","Impact of Personal Protection Habits on the Spread of Pandemics: Insights from an Agent-Based Model",2021,"The Scientific World Journal","hindawi.com","https://www.hindawi.com/journals/tswj/2021/6616654/","",267,"2021-06-03 16:24:07","HTML","","","",,,,,0,0.00,0,2,1,"Background. After several waves of spread of the COVID-19 pandemic, countries around the world are struggling to regain their economies by slowly lifting mobility restrictions and social distance measures applied during the crisis. Meanwhile, recent studies provide compelling …","https://www.hindawi.com/journals/tswj/2021/6616654/",""
0,"H Feng, T Xu, L Liu, S Zhou, J Zhao, S Liu, Z Xu, K Mao…","Modeling Transpiration with Sun-Induced Chlorophyll Fluorescence Observations via Carbon-Water Coupling Methods. Remote Sens. 2021, 13, 804",2021,"","search.proquest.com","https://search.proquest.com/openview/eb223d7277d97d6a0d6286bce624538d/1?pq-origsite=gscholar&cbl=2032338","",268,"2021-06-03 16:24:07","","","","",,,,,0,0.00,0,9,1,"Successfully applied in the carbon research area, sun-induced chlorophyll fluorescence (SIF) has raised the interest of researchers from the water research domain. However, current works focused on the empirical relationship between SIF and plant transpiration (T) …","",""
0,"P Pitchai, NK Jha, RG Nair, PJ Guruprasad","A coupled framework of variational asymptotic method based homogenization technique and Monte Carlo approach for the uncertainty and sensitivity analysis …",2021,"Composite Structures","Elsevier","https://www.sciencedirect.com/science/article/pii/S0263822321001173","",269,"2021-06-03 16:24:07","HTML","","","",,,,,0,0.00,0,4,1,"This article describes a computational framework, based on the variational asymptotic method unit cell homogenization technique coupled with the Monte Carlo method, for carrying out uncertainty and sensitivity analysis of the effective properties of fiber reinforced …","https://www.sciencedirect.com/science/article/pii/S0263822321001173",""
0,"D Risner, F Li, JS Fell, SA Pace, JB Siegel…","Preliminary Techno-Economic Assessment of Animal Cell-Based Meat. Foods 2021, 10, 3",2020,"","researchgate.net","https://www.researchgate.net/profile/Edward_Spang/publication/347858605_Preliminary_Techno-Economic_Assessment_of_Animal_Cell-Based_Meat/links/5ff3462645851553a01d9c07/Preliminary-Techno-Economic-Assessment-of-Animal-Cell-Based-Meat.pdf","",270,"2021-06-03 16:24:07","PDF","","","",,,,,0,0.00,0,6,1,"Interest in animal cell-based meat (ACBM) or laboratory-grown meat has been increasing; however, the economic viability of these potential products has not been thoroughly vetted. Recent studies suggest monoclonal antibody production technology can be adapted for the …","https://www.researchgate.net/profile/Edward_Spang/publication/347858605_Preliminary_Techno-Economic_Assessment_of_Animal_Cell-Based_Meat/links/5ff3462645851553a01d9c07/Preliminary-Techno-Economic-Assessment-of-Animal-Cell-Based-Meat.pdf","https://scholar.google.com/scholar?q=related:39cUixs-IL4J:scholar.google.com/&scioq=&hl=en&as_sdt=2005&sciodt=0,5"
0,"Q Ma","Feasibility study of an integrated flat-sheet solar heated membrane distillation module and equipment for autonomous and decentralized seawater desalination …",2019,"","tel.archives-ouvertes.fr","https://tel.archives-ouvertes.fr/tel-03081294/","",271,"2021-06-03 16:24:07","","","","",,,,,0,0.00,0,1,2,"Small-scale desalination at the point of use offers a potential access to drinking water to communities living in remote coastal areas or isolated islands. In this dissertation, Membrane Distillation (MD) is the applied technology for the aforementioned application …","https://tel.archives-ouvertes.fr/tel-03081294/document","https://scholar.google.com/scholar?q=related:wN6xi62773gJ:scholar.google.com/&scioq=&hl=en&as_sdt=2005&sciodt=0,5"
0,"S Brandstaeter, SL Fuchs, J Biehler, RC Aydin…","Global Sensitivity Analysis of a Homogenized Constrained Mixture Model of Arterial Growth and Remodeling",2021,"Journal of Elasticity","Springer","https://link.springer.com/article/10.1007/s10659-021-09833-9","",272,"2021-06-03 16:24:07","HTML","10.1007/s10659-021-09833-9","","",,,,,0,0.00,0,5,1,"Growth and remodeling in arterial tissue have attracted considerable attention over the last decade. Mathematical models have been proposed, and computational studies with these have helped to understand the role of the different model parameters. So far it remains …","https://link.springer.com/article/10.1007/s10659-021-09833-9",""
2,"AT Tunkiel, D Sui, T Wiktorski","Data-driven sensitivity analysis of complex machine learning models: A case study of directional drilling",2020,"Journal of Petroleum Science and …","Elsevier","https://www.sciencedirect.com/science/article/pii/S0920410520306975","https://scholar.google.com/scholar?cites=10500436756071885993&as_sdt=2005&sciodt=0,5&hl=en",273,"2021-06-03 16:24:07","HTML","","","",,,,,2,2.00,1,3,1,"Classical sensitivity analysis of machine learning regression models is a topic sparse in literature. Most of data-driven models are complex black boxes with limited potential of extracting mathematical understanding of underlying model self-arranged through the …","https://www.sciencedirect.com/science/article/pii/S0920410520306975","https://scholar.google.com/scholar?q=related:qawekJgLuZEJ:scholar.google.com/&scioq=&hl=en&as_sdt=2005&sciodt=0,5"
0,"A Lund, I Bilionis, SJ Dyke","Variational Inference for Nonlinear Structural‎ Identification",2020,"Journal of Applied and Computational …","jacm.scu.ac.ir","https://jacm.scu.ac.ir/article_15678_0.html","",274,"2021-06-03 16:24:07","","","","",,,,,0,0.00,0,3,1,"Research interest in predictive modeling within the structural engineering community has recently been focused on Bayesian inference methods, with particular emphasis on analytical and sampling approaches. In this study, we explore variational inference, a …","https://jacm.scu.ac.ir/article_15678_a5a2bd2c4c1e1c7f6c703e73383ae751.pdf","https://scholar.google.com/scholar?q=related:GKhAlSgHpEoJ:scholar.google.com/&scioq=&hl=en&as_sdt=2005&sciodt=0,5"
1,"NH Hsieh, B Reisfeld, WA Chiu","pksensi: An R package to apply global sensitivity analysis in physiologically based kinetic modeling",2020,"SoftwareX","Elsevier","https://www.sciencedirect.com/science/article/pii/S2352711020303228","https://scholar.google.com/scholar?cites=13935972854235818533&as_sdt=2005&sciodt=0,5&hl=en",275,"2021-06-03 16:24:07","HTML","","","",,,,,1,1.00,0,3,1,"Sensitivity analysis (SA) is an essential tool for modelers to understand the influence of model parameters on model outputs. It is also increasingly used in developing and assessing physiologically based kinetic (PBK) models. For instance, several studies have …","https://www.sciencedirect.com/science/article/pii/S2352711020303228","https://scholar.google.com/scholar?q=related:JWo2mHmFZsEJ:scholar.google.com/&scioq=&hl=en&as_sdt=2005&sciodt=0,5"
6,"H Xu, AF Badea, X Cheng","Sensitivity analysis of thermal-hydraulic models based on FFTBM-MSM two-layer method for PKL IBLOCA experiment",2020,"Annals of Nuclear Energy","Elsevier","https://www.sciencedirect.com/science/article/pii/S0306454920304308","https://scholar.google.com/scholar?cites=5436395904557928942&as_sdt=2005&sciodt=0,5&hl=en",276,"2021-06-03 16:24:07","HTML","","","",,,,,6,6.00,2,3,1,"Intermediate break loss of coolant accident (IBLOCA) is a focus of nuclear safety these years. A PKL IBLOCA benchmark was performed in order to evaluate the reliability of system thermal-hydraulic (STH) codes on IBLOCA. ATHLET was used for post-test calculations. But …","https://www.sciencedirect.com/science/article/pii/S0306454920304308","https://scholar.google.com/scholar?q=related:7lGQnUX1cUsJ:scholar.google.com/&scioq=&hl=en&as_sdt=2005&sciodt=0,5"
0,"T Iwanaga, X Sun, Q Wang, JHA Guillaume…","Property-based Sensitivity Analysis: An approach to identify model implementation and integration errors",2021,"… Modelling & Software","Elsevier","https://www.sciencedirect.com/science/article/pii/S1364815221000566","",277,"2021-06-03 16:24:07","HTML","","","",,,,,0,0.00,0,5,1,"Diagnostic testing is an oft-recommended use of sensitivity analysis to assess correctness or plausibility of model behavior. In this paper we demonstrate the use of sensitivity analysis as a complementary first-pass software test for the validation of model behavior. Typical testing …","https://www.sciencedirect.com/science/article/pii/S1364815221000566",""
